Code,Folder,Theme,Date,Time,Author,Message
30,Ходовая-Рулевая,'Рулевое управление LADA Granta -2',01.07.2014, 13:40,Виктор08,'Вчера обнаружил, пыльники шарового шарнира на рулевой рейке с обоих сторон потрескались и рассыпаются, возможно ли заменить только пыльники, или придется менять наружный наконечник с шаровым шарниром? З.Ы. Машине 2 года пробег 16 тысяч, я просто не могу выразить словами свое восхищение качеством комплектующих.'
30,Ходовая-Рулевая,'Рулевое управление LADA Granta -2',08.07.2014, 19:44,Александр (Первоуральск),'На счет карданчика я ошибался! Вчера повнимательней рассмотрел сборку рулевого (представлена в начале темы), обнаружился еще один болт крепления карданчика, он спрятан за блоком управления ЭУР. Сегодня в гараже нащупал его - оказалось он был закручен ОТ РУКИ ! После протяжки дребезжание почти пропало!'
30,Ходовая-Рулевая,'Рулевое управление LADA Granta -2',08.07.2014, 20:14,Wine,'Поподробнее плиз, если можно с картинкой и описываемой точкой крепления.'
30,Ходовая-Рулевая,'Рулевое управление LADA Granta -2',08.07.2014, 20:48,Александр (Первоуральск),'На фото - 11 позиция.'
30,Ходовая-Рулевая,'Рулевое управление LADA Granta -2',09.07.2014, 17:56,TO-13,'Только недавно заметил, что из левого поворота рулевое колесо недовозвращается в 0, а из правого поворота наоборот перекручивается примерно на 45 градусов. Хотя если руль выставить в 0 и отпустить машина едет прямо и руль остается в 0. В чем м.б. причина?'
30,Ходовая-Рулевая,'Рулевое управление LADA Granta -2',10.07.2014, 16:12,mikos,'Возможно рейка ослабла, попробуй подтянуть. Я когда перестарался с ослаблением рейки, тоже ноль проскакивала при возвращении из поворота.'
30,Ходовая-Рулевая,'Рулевое управление LADA Granta -2',10.07.2014, 21:13,TO-13,'Рейку подтянули на ТО2 (не ОД) - сказали , что гремела, хотя я не слышал)). Сход-развал сделан, выявлено небольшое отклонение развала правого колеса - устранено. Случайно заметил этот косяк с 0, даже не знаю было ли раньше так.'
30,Ходовая-Рулевая,'Рулевое управление LADA Granta -2',10.07.2014, 22:49,Ra'dic,'(переписал пост ниже)'
30,Ходовая-Рулевая,'Рулевое управление LADA Granta -2',11.07.2014, 06:25,www-shurik,'Похожая ситуация (только у меня из правого поворота и градусов 5-10 всего). Смазку рейки проверил. Пробовал ослаблял рейку (потом снова затянул). Но у меня сложилось впечатление, что это погрешность оборудования сход/развал (кастер там вообще не измеряют, может он тоже с погрешностью, т.к. когда почитал форумы кастер с завода часто идёт с погрешностью до 1 град не только у лады в сумме с другими погрешностями даст больший эффект). В сл. раз поезду на 3D сход развал и измерю кастер. Ситуацию заметил после регулировки сход/развал. До этого вообще не было нормального нуля (схождение в минус). На вывешенном авто ход рейкой (за колесо) вполне лёгкий не смотря даже на ЭУР, поэтому я грешу на точность регулировки сход развал. Делал не дорого (500 руб) - 4 прибора вешали на колёса, между ними какие то лески (даже не оптика), в комп из базы выбрали параметры гранты (с слов мастера, на экране я не видел - только циферки т.е. закралась мысль, а вдруг там что то не учёл, мало ли - когда сам не вникаю, что делают, всегда есть подозрение на халтуру). Но появился нормальный возврат руля в ноль и на скорости перестало кидать авто при слабом повороте рулём. И как я понял, настройку нужно делать снаряжённого авто - по логике нужно мне было бы сидеть в машине. Колёса были зимние (кумхо на литье), на штатной каме всё точно также. Давление шин проверяли перед регулировкой.'
30,Ходовая-Рулевая,'Рулевое управление LADA Granta -2',11.07.2014, 07:01,Ra'dic,'Рейку то тянуть зачем было, если не слышно было бряканья ? возвращался ведь руль, просто ноль не к месту. Электроусилитель умеет/обучен возвращаться в ноль? (при каких условиях?) = если вывесить перед - можно ли так проверить? Или проще поступить - отключить разъем (предохранитель совмещен наверно эще с каким потребителем?) Если в итоге выяснится что электроусилитель "знает/обучен" возвращаться в ноль = переставить шлицы на руле; и на карданчике (если рулевые тяги симметрично настроены, и что бы `сход` заново не выставлять. Может быть просела пружина под водителем больше? шина левая больше изношена ? (как с пассажиром?) Греются диски/шины одинаково ( давление; тормоза) Ночью во сне придет ответ ))) (немного юмора не помешает, а то мы мало расслабляемся в стремлении к совершенству). Смазки где-добавить ))) и какую деталь заменить/переустановить. А как кстати после новой регулировки `развала` - ноль нормальный теперь ? (а то я тут понаписал теорию) Добавлено через 23 минуты 1) буду искать способ самому измерить кастор, с минимальной погрешностью (практический интерес) 2) делать фото с экрана (или распечатку) 3) попросить мастера чтобы сфоткал или распечатал параметры и пустой и с сидящим в авто водителем (интересно на сколько уходят углы-сход/развал)'
30,Ходовая-Рулевая,'Рулевое управление LADA Granta -2',11.07.2014, 09:09,www-shurik,'Вот для этого надо было сразу мне ехать в такой центр. На 3Д я так понял и кастор выведут. Не знаю как это делается (рулём будут крутить с мишенью или ещё как то?). С мишенями по компу точность выше. С электронными "приспособами" на колёсах как то не так точно (зависит от попраки на кривизну дисков, просто кто то ронял эти устройства и т.п.) + точно закреплённого уровня (как давно его проверяли). А то я тут уровень на 180 град у себя развернул, положив его на ванную, а пузырёк ушёл (на той же плоскости - это знак не верной настройки "уровня" плоскость то одна). Ослаблял крепление пузырька - ошибка 1мм на 1 метр была. Не знаю какая точность нужна для авто.'
30,Ходовая-Рулевая,'Рулевое управление LADA Granta -2',11.07.2014, 13:54,Ra'dic,'Оценю к ночи погрешность для выставления "уровнем" "развала"; пока занят. Скину в тему про сход развал. Но держу сейчас в руках уровень, и думаю что для нашей рулевой этого примитивного прибора будет достаточно. А вот кастор пока не знаю как измерить самому, через месяц буду думать про это. У некоторых глазами заметно, и ездят))) Видел как колесо катится чье то... авто благополучно у обочины остановилось, выбежал мужик догонять колесо через встречную полосу в кусты ))) ехал не быстро'
30,Ходовая-Рулевая,'Рулевое управление LADA Granta -2',11.07.2014, 18:32,www-shurik,'Открываем капот, кладем длинную рейку поперек машины выставляя ее одинаково над штоками передних амортизаторов (возможно нужна небольшая поправка рейки вперёд, т.к. рейка лежит не на оси вращения). Вешаем отвесы (одинаково с обоих сторон). Меряем расстояние от ниток до оси передних колес, длину нитки от этой точки до точки вращения - получаем параметры прямоугольного треугольника, по длине двух катетов вычисляем угол. Я думаю ещё есть смысл базу сравнить слева и справа. Возможно задняя балка может на кузове тоже быть не совсем ровно (из-за качества сварки самого кузова + крепления балки).'
30,Ходовая-Рулевая,'Рулевое управление LADA Granta -2',12.07.2014, 15:24,Ra'dic,'Скинул предварительный расчет по углу развала, пост 413: http://www.lada-granta.net/showthrea...t=3574&page=42 Добавлено через 1 минуту Интересно, надо попробовать :-)'
30,Ходовая-Рулевая,'Рулевое управление LADA Granta -2',12.07.2014, 17:51,Mishanya,'Мне кажется лучше всё отследить на 3Д стенде и в реальном времени глядя на монитор всё быстренько настроить, чем морочиться с палочками и ниточками, конечно не бесплатно будет, зато быстро и точно. Только вот мастер ещё адекватный нужен.'
30,Ходовая-Рулевая,'Рулевое управление LADA Granta -2',13.07.2014, 08:14,Ra'dic,'как удалить свой пост?'
30,Ходовая-Рулевая,'Рулевое управление LADA Granta -2',13.07.2014, 18:16,Ra'dic,'Отзывы о 3 d стендах www.autolada.ru/viewtopic.php?t=289145'
30,Ходовая-Рулевая,'Рулевое управление LADA Granta -2',13.07.2014, 21:39,vess,'Ra`dic, отзывы о стендах людей, которые на них не работают... Занятно... На сегодня, оптические стенды с мишенями, которые крепятся на колёса, самые оптимальные по надежности и уровню защиты от дурака. Но, такой стенд это измерительный прибор, требующий регулярной поверки и регулировки. Проверяется и регулируется в основном положение площадки колейного подъёмника, на который устанавливается автомобиль и соответствующее положение сенсоров на стойке. Чем меньше времени прошло с последней поверки, тем меньше шансов, что сотрудники СТО успели сотворить со стендом какое нибудь непотребство)). Чем больше проход машин через подъёмник, на котором стоит стенд, тем быстрее уплывает база площадки. В частных случаях, можно упороть в стойку подъёмника машиной, или смахнуть сенсор чем нибудь. Приходилось видеть, как люди работают на стенде, который постоянно в процессе "теряет" мишень. Какой там результат)).'
30,Ходовая-Рулевая,'Рулевое управление LADA Granta -2',14.09.2014, 16:59,MNTiger,'При выходе из поворота, руль возвращается не до конца. Приходится руками немного доворачивать, чтобы прямо встал. Это гарантийный случай?'
30,Ходовая-Рулевая,'Рулевое управление LADA Granta -2',15.09.2014, 16:42,BIBERlist,'MNTiger, Вероятно у вас пробег не большой, судя по модели. У новой машины руль может и не возвращаться в ноль. Шаровые опоры и рулевые наконечники ещё пока тугие. Тысячи 3-5 проедите станет возвращаться. Хотя на своей я сразу чуть отпустил рейку и смазал, по ощущениям была перетянута. Лучше стала курсовая устойчивость. Но на 15000 км опять чуть подтянул на место.'
30,Ходовая-Рулевая,'Рулевое управление LADA Granta -2',23.09.2014, 10:26,вова черниговский,'Мужики,подскажите какие тяги рулевой трапеции стоят на гранте?явно не калиновские!похожи на эти.http://xn--80agd2a.xn--p1ai знать бы еще каталожный номер.мастер сказал что вроде бы десяточные'
30,Ходовая-Рулевая,'Рулевое управление LADA Granta -2',23.09.2014, 12:05,www-shurik,'На 1500 - 3000 пробега тоже была такая проблема. Я даже рейку крутил (ослаблял). Потом вернул правда на место. И хотел её смазать, но смазка тоже была там сколько надо. Сейчас всё само собой куда то ушло - видимо как пишут - туго всё работало. Значит притёрлось. Либо привык - никакого дискомфорта нету. Пробег сейчас 9700 км. Слабый шум в крестовинах(или в ЭУР, как тут писали) только есть по гравийки, но когда ездил на ниссане (чуть постарше 2009г.в.), понял, что надо ехать там не под 50км/ч, а под 10км/ч и тоже шума не будет ))) Может есть старые воспоминания (идельного авто), когда казалось авто не шумит а шепчет, просто когда автомобилю 10 лет на это внимание может и не обращаешь. А когда новый любое отклонение от идеала уже настораживает.'
30,Ходовая-Рулевая,'Рулевое управление LADA Granta -2',23.09.2014, 15:01,вова черниговский,'некорректную ссылку дал-вот другая: http://car-exotic.com/lada-granta/va...teering-8.html. на моей гранте стоит такая как на самом последнем рисунке.кто знает помогите опознать!))'
30,Ходовая-Рулевая,'Рулевое управление LADA Granta -2',23.09.2014, 18:23,www-shurik,'До замены тяг ещё не у многих дошло и вероятно во многих магазинах даже не скажут правильно. А по изгибам можно как то идентифицировать? Сравнить в магазине например?'
30,Ходовая-Рулевая,'Рулевое управление LADA Granta -2',23.09.2014, 21:00,TO-13,'Да вроде калиновские) Первая картинка Гранта. Вторая картинка Калина-2.'
30,Ходовая-Рулевая,'Рулевое управление LADA Granta -2',24.09.2014, 20:51,вова черниговский,'Спасибо-завтра таки сниму и по магазинам проедусь с образцом.вроде на калиновские похожи в итоге.всем удачи и чтоб машина не ломалась!'
30,Ходовая-Рулевая,'Рулевое управление LADA Granta -2',26.09.2014, 16:07,Excentro_24,'Подскажите кто может сталкивался с проблемой: Когда разгоняешься и руль возвращаешь в 0 раздаётся такой сильный одиночный стук со стороны моторного щита, при этом стук ощущается и на руле и на педалях. Куда копать? у рейки люфта нет. Пробег 25к на автомате.'
30,Ходовая-Рулевая,'Рулевое управление LADA Granta -2',01.10.2014, 22:22,arti1707,'При установке руля в 0 машина начинала уходить понемногу, то вправо, то влево(приходится подруливать каждые 100-150м на 5-10 градусов). Никак не мог понять от дороги это или косяк какой, грешил на балансировку, съездил выравняли, выехал все равно уводит, правда слабее. Решил поменять передние колеса на задние, практически не помогло. Что может быть? Некачественная работа сервиса или все таки косяк в железе. Пробег 22000, давление в шинах равное, 2.0. С завода шла ровно, как по рельсам. Сие же "чудо" наблюдается где-то с 18000. Говорят выключить ЭУР и проехать без него(безопасно ли это?), но не думаю, что он так может влиять. Вообщем запутался, проблема очень утомляет на поездках свыше 30-50 км.'
30,Ходовая-Рулевая,'Рулевое управление LADA Granta -2',02.10.2014, 00:38,Oleg08,'Рейка не люфтит, а может зажата? У меня с новья была зажата маленько, тоже приходилось ловить на дороге.'
30,Ходовая-Рулевая,'Рулевое управление LADA Granta -2',02.10.2014, 08:00,s.potexin,'arti1707, обрати внимание на дорожное покрытие, где это происходит. ТОже меня одно время это мучило. Почему машину тащит в сторону. А как разобрался, оказалось это все совокупность нескольких факторов. Если в городе: это явно колея виновна. Если за городом, совместно колея и ветер, либо просто ветер. либо одна колея'
30,Ходовая-Рулевая,'Рулевое управление LADA Granta -2',03.10.2014, 10:00,BIBERlist,'arti1707, В яму не попадали, развал- схожд. не нарушился? Опорные подшипники не хандрят? При вращении руля на месте от края до края не слышится звук будто скребут по железной бочке? Не повредит смазать рейку со снятием резиновых колпачков. Справа просто нанести смазку на шток, слева обильно натолкать.'
30,Ходовая-Рулевая,'Рулевое управление LADA Granta -2',03.10.2014, 16:34,arti1707,'В яму да, было пару раз, развал-схожд. вот на днях делали. Звуков вроде нет, только звук ЭУР, но это норма вроде. Может балансировка шин? Подшипники как проверить подскажете? Главное с завода шла ровно-ровно, вот последние тысячи 3-4 так началось. Схожд-развал делали первый раз на 22000,т.е. на прошлой неделе, вроде не помогло. Ладно поищу ровную дорогу, проверю тщательно. А еще заметил, если отпустить руль и резко ускорится на 2, то руль моментом и резко уводит вправо градусов на 30-50 наверно, потом едет ровно, но с дороги от этого уже съезжает, но это вроде тоже норма или нет)'
30,Ходовая-Рулевая,'Рулевое управление LADA Granta -2',03.10.2014, 16:50,www-shurik,'А где развал/схождение делали- может причина не верно выбранной машины из базы (там в компе выбирают авто и по нему уже делают). Или это в салоне ОД. Как вариант мастер новичёк. Но виной этому часто отрицательно схождение - это когда колёса смотрят в разные стороны. Почему так вышло - можно только гадать. Может на СТО стажёр, может оборудование у них хорошо роняли .... Или просто безответственный исполнитель - который видит проблему, но если для её решеняи нужно больше обычного делать, то из-за одного клиента не чего делать не будут. Желательно взять карту замера (распечатать) - так делают все нормальные СТО. + самому осмотреть авто на яме - бывают даже гайги забывали затянуть (совсем недавно пример был у моего коллеги) . Достаточно 0,30 минут, чтобы так приходилось подруливать. При этом в какую сторону - случайно выходит, то влево, то вправо. Вид сверху'
