Code,Folder,Theme,Date,Time,Author,Message
30,Ходовая-Рулевая,'Механические проблемы с ЭМУР',30.05.2012, 01:13,VIRUS,'Если так, то скорее всего,жена постоянно выкручивала до упора руль,но я думал что ни как у меня на приоре на гидраче,думал можно долго до упора,оказывается тоже не мона, перегревается Добавлено через 3 минуты Честно тупа клин, как рулём в бардюр упёрся,я то ездил без усилителя и на шохе,и на десятке,но это не то,я бы выкрутил руль'
30,Ходовая-Рулевая,'Механические проблемы с ЭМУР',30.05.2012, 08:36,i-VEK,'Ну, у меня после того единственного случая, который я описал выше, уже в течение 500 км никаких признаков увода руля не замечается. Я уже расслабился и практически забыл про него А так эур работает замечательно, и поначалу он мне казался туже, чем на иномарках гур (с которыми имел возможность сравнить), но потом, когда сел к другу, чтобы перегнать его 12-ку, я понял, что эур - это вещь! А тем людям, которые жалуются на рысканье по трассе, отсутствие нулевой зоны и слабый возврат к ней, даю бесплатный совет))): смените "резину" с обычным рисунком протектора на резину с направленным рисунком протектора, тогда машина будет ездить как по рельсам'
30,Ходовая-Рулевая,'Механические проблемы с ЭМУР',09.06.2012, 23:38,x85,'а я вот буду заявлять что авто само доруливает влево на гсто. задолбало.'
30,Ходовая-Рулевая,'Механические проблемы с ЭМУР',17.06.2012, 21:20,rtmp,'на третьей странице писал что руль ведет влево, вот прошел ТО 2000-3000, сделали развал, и проблема осталась'
30,Ходовая-Рулевая,'Механические проблемы с ЭМУР',20.06.2012, 02:12,nsNet,'Это вы ещё ЭГУР не крутили )) тут вам и адаптивность и обратная связь )'
30,Ходовая-Рулевая,'Механические проблемы с ЭМУР',20.06.2012, 03:19,trek,'Знаете, такой же восторг после грантовского руля. Про адаптивность ничего не скажу, не знаю что это. Обратная связь, в смысле реактивный момент правильный, не как у американцев, где баранку на месте одним пальцем крутишь. В повороте машина рулем ощущается хорошо, на дуге вообше как привязанная идет.'
30,Ходовая-Рулевая,'Механические проблемы с ЭМУР',20.06.2012, 10:51,AMFITON,'А я тут на своей старушке (21083) съездил на работу. Теперь от руля гранты просто в восторге))) Хотя поначалу на трассе не нравилось, казался тяжелым.'
30,Ходовая-Рулевая,'Механические проблемы с ЭМУР',24.06.2012, 20:02,nsNet,'Адаптивность это когда чем скорость больше - тем тяжелее руль.'
30,Ходовая-Рулевая,'Механические проблемы с ЭМУР',24.06.2012, 20:12,vess,'Гранта это умеет.'
30,Ходовая-Рулевая,'Механические проблемы с ЭМУР',24.06.2012, 20:29,nsNet,'vess, я знаю, но вот с обратной связью у Гранты беда))'
30,Ходовая-Рулевая,'Механические проблемы с ЭМУР',24.06.2012, 22:34,trek,'Вот она как раз великолепная, что и удивляет. Реактивный момент есть всегда. Колеса рулем хорошо на ходу ощущаются.'
30,Ходовая-Рулевая,'Механические проблемы с ЭМУР',10.07.2012, 23:18,x85,'moRz, ну вот, уже ближе к делу, все это описывается 1 словом - флуд) вопрос в другом и по теме - кто ни будь заявлял о довороте налево по гарантии?'
30,Ходовая-Рулевая,'Механические проблемы с ЭМУР',11.07.2012, 00:24,VIRUS,'По сравнению с калиной это супер руль,немного уступающий гуру на приоре,но калиновская вата отсутствует Добавлено через 6 минут Тоже здесь не согласен,для наших дорог уж лучше резина наша,шумно но надёжнее,я вот на ковке комплект нокии на мусорку выкидывал с отличным протектором,а вот каму второй сезон катаю без потерь только диски протираю от отметин залазинья резины на диск,а резине хоть бы хны'
30,Ходовая-Рулевая,'Механические проблемы с ЭМУР',11.07.2012, 10:28,moRz,'Заявляли, И на сегодняшний день ничего не изменилось! А вот и долгожданный ответ с АВТОВАЗа: Система обратной связи ОАО `АВТОВАЗ` От кого: robot@vaz.ru Кому: housest@mail.ru 2 июня 2012, 11:36 Здравствуйте, Константин! В систему обратной связи ОАО `АВТОВАЗ` от Вас поступил вопрос: 30.04.12 "Добрый день! Проблема в следующем! Еду, подъезжаю к перекрестку, начинаю останавливаться, руль начинает сам влево крутиться о_О! Сначала списал все на колею, но потом это начало повторяться! Когда я еду и поворачиваю руль вправо, он по идее должен возвратиться в центральное положение(так называемый ноль), а ЭУР возвращает его не в ноль а чуть дальше, тем самым направляя машу на лево, а в последнее время это начало происходить когда едешь прямо! Дискомфорт ужасный! Приехал к оф. диллеру! И услышал ответ :"На данный момент, дефектом не является! На всех грантах это присутствует и проявляется у кого как. Т.Е. в большей или меньшей степени. Инженеры ВАЗа разбираются! Как только выяснят проблему, пришлют предписание!" Так ли это? Помогите решить данный вопрос!" 02.06.12 "Добрый день, Константин! Проблема действительно на АВТОВАЗе известна и действительно работы по этой теме ведуться." Отдел анализа качества а/м в эксплуатации и работы с претензиями потребителей. Бюро анализа работы сервисной сети. Инженер-технолог. Ну-ну! Шумно - можно музыку погромче! Жестко - можно подушечку подложить на сиденье! Да?))) В корне не правильно! Резина должна обеспечивать уверенное сцепление автомобиля с дорогой, это касается торможения, разгона и отклика рулю! Безопасность - вот на чем нужно основываться! И очень не приятно при экстренном торможении, когда импортная шина уже уверенно остановилась, слышать визг тормозящей сзади камы! Пусть будет так!'
30,Ходовая-Рулевая,'Механические проблемы с ЭМУР',12.07.2012, 09:58,Antontlt,'Причина не в ЭУРе вот тема. Там чел отключал ЭУР и машину все равно тянет влево. Смотри там же пост 26 )). У меня, кстати, тоже тянет влево немного. Но сильно не напрягает пока. На ТО1 проверили развал - нормальный (хотя я в этом не уверен, поищу нормальный сервис с развалом).'
30,Ходовая-Рулевая,'Механические проблемы с ЭМУР',12.07.2012, 12:28,moRz,'Проблема не в том что машину тянет! Руль сам поворачивается влево! Т.е. едешь на маленькой скорости например по дачному массиву и руль сам поворачивается на 1 оборот(дальше не пробовал а то можно в забор въехать)" Добавлено через 2 минуты Согласен полностью! Это был просто как пример!'
30,Ходовая-Рулевая,'Механические проблемы с ЭМУР',12.07.2012, 19:24,NAIL,'moRz, Как раз такая ситуация бывала на Приорах. Из за чего это происходило скажу следующее просто на заводе меняли платы электроусилителя с импортного на отечественный. В том то и дело отечественная только еще тестировалась и к тому же там была плохая пайка. Вот такие результаты.'
30,Ходовая-Рулевая,'Механические проблемы с ЭМУР',12.07.2012, 19:28,H.A.J.,'у меня вопрос, если эур сойдет с ума ))) - он сможет отобрать у меня руль? )))'
30,Ходовая-Рулевая,'Механические проблемы с ЭМУР',12.07.2012, 20:07,NAIL,'H.A.J., Он может без Вашего ведома качнуть рулевое колесо в сторону'
30,Ходовая-Рулевая,'Механические проблемы с ЭМУР',12.07.2012, 20:08,H.A.J.,'нуу я в смысле - смогу его удержать?'
30,Ходовая-Рулевая,'Механические проблемы с ЭМУР',12.07.2012, 20:20,NAIL,'H.A.J., Удержать то сможете.'
30,Ходовая-Рулевая,'Механические проблемы с ЭМУР',12.07.2012, 21:10,CHURA,'я если руль не удерживаю, потягов нет. Но если руки на руле, чувствуется легкое усиление влево. Подозреваю о плохо откалиброванном "сравнительном мосте" ЭУР'
30,Ходовая-Рулевая,'Механические проблемы с ЭМУР',12.07.2012, 23:49,NAIL,'Обычно такие рывки рулевого колеса возникают от электроусилителей фирмы Автоэлектроника.'
30,Ходовая-Рулевая,'Механические проблемы с ЭМУР',13.07.2012, 00:42,trek,'После сказанного про разы тормозного пути, извините, не верится вам вообще, и про дефекты ЭУР тоже Добавлено через 6 минут Если машину в сторону тащит при брошенном руле, при чем здесь ЭУР, на развал надо ехать, а не теоретизировать про сравнительные мосты'
30,Ходовая-Рулевая,'Механические проблемы с ЭМУР',13.07.2012, 00:43,CHURA,'trek, а повнимательнее читать пробовали!? Как раз при свободном то и не ведет'
30,Ходовая-Рулевая,'Механические проблемы с ЭМУР',13.07.2012, 00:58,trek,'я если руль не удерживаю, потягов нет http://www.lada-granta.net/newreply....reply&p=117370 Вот именно это я прочитал.'
30,Ходовая-Рулевая,'Механические проблемы с ЭМУР',13.07.2012, 00:58,VIRUS,'Нет не сможешь,с махачкалинскими приоры загоняли по гарантии двумя руками еле еле держали но он эур хитрый рывками рвал,но оттормозится можешь и успеть но рывок резкий и на скорости если бы было, то хана,благо он дохлый на скорости и силы такой не имеет как на стоячей.После махачкалинских такой ерунды больше не встречалось'
30,Ходовая-Рулевая,'Механические проблемы с ЭМУР',13.07.2012, 09:35,moRz,'Ваше дело, но как не крути разница есть! Прочитайте ответ АВТОВАЗа мне! Стал бы я не имея деффекта писать в администрацию ВАЗа?'
30,Ходовая-Рулевая,'Механические проблемы с ЭМУР',13.07.2012, 10:57,CHURA,'trek, так если со свободным рулем все гут, то значит дело не в "развал-схождение"..? ЭУР же не активен пока не качнешь руля'
30,Ходовая-Рулевая,'Механические проблемы с ЭМУР',13.07.2012, 11:50,VIRUS,'Кто такое сказал вам?Он активен всегда после запуска двигателя,с набором скорости только меньше усиливает,а так и 200 км.час он работает но с минимальным усилием'
30,Ходовая-Рулевая,'Механические проблемы с ЭМУР',13.07.2012, 13:55,H.A.J.,'он вроде после 80 - сходит на нет ... где то читал, возможно ошибаюсь ...'
30,Ходовая-Рулевая,'Механические проблемы с ЭМУР',13.07.2012, 14:51,moRz,'Тоже слышал!'
30,Ходовая-Рулевая,'Механические проблемы с ЭМУР',14.07.2012, 22:06,x85,'ковырял я когда то сам махачкалинский эур на своей калине, так там это подстроечными резисторами настраивалось все - можно было бы вывести, как и подстроить под себя момент компенсации. Тут же в Монд`е этом без понятия, да и ползти не хочу, пусть завод разбирается.'
30,Ходовая-Рулевая,'Механические проблемы с ЭМУР',17.07.2012, 19:35,vess,'Касательно "подруливания" ЭУРом. Позавчера прошёлся OpenDiag`ом по блокам Калины. БУ ЭМУР Mando выдаёт в измеряемые величины момент, измереный датчиком момента, расчётный ток и измереный ток на серводвигателе. ИМХО вполне достаточно для экспресс диагностики ЭМУР. Кто-нибудь пробовал Гранту с самоподруливанием опрашивать?'
30,Ходовая-Рулевая,'Механические проблемы с ЭМУР',16.08.2012, 09:07,Дмитрий Камский,'Добрый день! Ребята при вождение такое ощущение, что есть инерционность в рулевом управлении....То есть вроде повернул баранку, а через секунду начинают колеса поворачивать, то есть нет прямой четкой связи, небольшое запаздывание....что это?'
30,Ходовая-Рулевая,'Механические проблемы с ЭМУР',17.08.2012, 00:13,vess,'Ну, во-первых, это дублирование сообщения http://www.lada-granta.net/showpost....&postcount=136. А по теме - поставьте автомобиль на асфальтовую площадку, откройте капот, посадите за руль помощника. Попросите помощника крутить руль из стороны в сторону градусов на 120 и смотрите на правую опору рулевой рейки (как раз над катколлектором). Вопросы, думаю, сами отпадут.'
30,Ходовая-Рулевая,'Механические проблемы с ЭМУР',17.01.2013, 08:55,paldis,'Вы знаете, у меня тоже есть проблема с доворотом руля влево. Ситуация такая: при езде примерно 20-30 км/ч при повороте налево руль не возвращается в положение "прямо", а при повороте направо руль через положение "прямо" немного уходит влево. Развал делал 3 раза у разных ПССС-ников, жаловался на проблему, они её видели, но разводят руками: развал в норме, ЭУР не подклинивает, типа это на многих Грантах, и типо это норма. Но я всё же не согласен. Раньше у меня была Калина - таких проблем я просто не знал. Причём невозврат с левого поворота у меня и при летней резине, и при зимней шипованой. На скорости (от 50 и более) руль возвращается в ноль, как и положено. Почитав эту тему, тоже решил написать на ВАЗ через "обратную связь" о своей проблеме. Может и будет позже какое-нибудь решение...'
30,Ходовая-Рулевая,'Механические проблемы с ЭМУР',17.01.2013, 09:03,trek,'paldis, банально конечно, но попробуйте передние колеса местами поменять.'
30,Ходовая-Рулевая,'Механические проблемы с ЭМУР',17.01.2013, 13:22,Antontlt,'У меня тоже машину тянуло влево. Кстати есть про это ветка: http://www.lada-granta.net/showthread.php?t=4358&page=8. У меня примерно на 6000 км этот эффект ушел сам собой на родной резине. При этом я ничего не делал. У меня несколько предположений по этому косяку: 1. Настройка нуля ЭУРа. К сожалению о нем нет сведений. Можно поробовать вылечить, скинув клемму аккумулатора на пару минут при прямом направлении колес. Но думаю не поможет. 2. Резина такая. В той ветке, которую я указал, один форумчанин именно так вылечил. 3. Подшипники ступиц, гранаты и все, что мешает вращаться... 4. Развал-схождение. Вот иметь бы информацию по ЭУРу.....мммм'
30,Ходовая-Рулевая,'Механические проблемы с ЭМУР',17.01.2013, 17:47,paldis,'Поймите правильно: одно и то же как на летней резине, так и на зимней. Не верю, что мне 2 раза попадает такое "плохое" колесо. Добавлено через 3 минуты У меня не тянет машину влево, руль не возвращается после выполнения левого поворота в положение "прямо". Я экспериментировал после регулировки развала: на скорости 60 км/ч на ровной дороге отпускал руль - машина едет прямо.'
30,Ходовая-Рулевая,'Механические проблемы с ЭМУР',18.01.2013, 13:28,paldis,'Вчера написал письмо через систему обратной связи на ВАЗ. Посмотрим, что ответят.'
