Code,Folder,Theme,Date,Time,Author,Message
30,Ходовая-Рулевая,'Рулевое управление LADA Granta',20.03.2013, 20:25,alex 31,'У меня самого при повороте влево руль приходиться докручивать в 0, а из правого поворота руль сам возвращается в 0 и перескакивает на 10-15 градусов левее, при чем вправо тяжелее поворачивать руль, а влево легко. Но по прямой едет ровно, руль бросал никуда не уводит. Делал диагностику все в норме, только кастер разнит, но в пределах нормы на левом 2,23 а на правом 2,5. Я лично склонен думать, что из-за него, т.к. здесь http://www.ddmitry.ru/cars_tuning_add_caster.htm прочитал: "Угол кастера задаваемый производителем, для автомобилей с полным и передним приводом, устанавливается от 0 гр. до 2 гр. что делает рулевое колесо более легким а снос передней оси ранним и менее чувствительным. Добавление угла кастера до 3-4 гр. улучшит сцепление передней оси на входе в поворот а руль станет более тяжелым и в какой то степени более информативным."'
30,Ходовая-Рулевая,'Рулевое управление LADA Granta',20.03.2013, 20:44,petrowix,'сход развал делали на то 1 ,рейку навроде не трогали, отметки не нарушены.'
30,Ходовая-Рулевая,'Рулевое управление LADA Granta',20.03.2013, 20:51,Oleg08,'Новая машинка, 700 км., хоть и ЭУР, но руль был заметно тяжелый и неравномерно как-то крутился. Попросил мастеров отпустить рейку и проверить смазку. И точно - рейка оказалась перетянутая и сухая. Отпустили на 30", набили литолом - руль полегчал заметно. Делали не на вазовском сервисе и не по гарантии, гарантийщикам замучишься доказывать.'
30,Ходовая-Рулевая,'Рулевое управление LADA Granta',20.03.2013, 20:56,petrowix,'в том и дело что руль лёгкий ,что на скорости ,что на месте.Пересел на лг с 2109 ,две большие разницы'
30,Ходовая-Рулевая,'Рулевое управление LADA Granta',20.03.2013, 23:30,vess,'Рулевой механизм такой же, углы устаговеи колес такие же. Амортизаторы конструктивно такие же, опорные подшипники такие же. Гранта стандарт в ходовой части близко повторяет калину. Усилие на рулн как на калине без усилителя.'
30,Ходовая-Рулевая,'Рулевое управление LADA Granta',21.03.2013, 09:41,volkuzul,'А я думал, что на Гранте стандарт и норма стойки одинаковые, отличие только в верхних опорах. На норме смещена точка крепления штока для увеличения кастора. В отзывах пишут, что Гранта идет мягче. Дык это только к норме относится? Я больше склоняюсь к стандарту, но боюсь что руль окажется дубовым как в калине.'
30,Ходовая-Рулевая,'Рулевое управление LADA Granta',21.03.2013, 13:21,vess,'volkuzul, пружины и настройки амортизаторов у калины и гранты разные. Но на руле это никак не отражается'
30,Ходовая-Рулевая,'Рулевое управление LADA Granta',21.03.2013, 14:09,volkuzul,'А как же верхние опоры? Разный кастор должен влиять. Ведь на калине кастор в норме и стандарте одинаков, а на гранте именно для облегчения руления на стандарте кастор уменьшен.'
30,Ходовая-Рулевая,'Рулевое управление LADA Granta',21.03.2013, 14:24,BIBERlist,'petrowix, Как вам советовали выше, сделайте регулировку развал-схождение.'
30,Ходовая-Рулевая,'Рулевое управление LADA Granta',05.01.2012, 22:10,DP1980,'Вопрос ко всем обладателям LADA Granta: - Какой рулевой механизм установлен на серийных авто, - Сколько оборотов руля от "упора до упора" - Кто производитель электро-усилителя, - Каковы ощущения от рулевого управления.'
30,Ходовая-Рулевая,'Рулевое управление LADA Granta',23.03.2013, 16:42,TOSJ,'На норме думаю намного больше, у меня на Калине без ЭУР кастор был 1.5 тяжело на месте крутить было, у Гранты 2.5 еще тяжелее будет.На стандарте тук же как на Калине и других переднеприводных с таким же кастором.Если 1 градус сделать вполне комфортный руль получаеться, но с 1.5 рулиться получше.'
30,Ходовая-Рулевая,'Рулевое управление LADA Granta',26.03.2013, 20:27,Vova2012,'а может просто поменять тарельчитую пружину...?'
30,Ходовая-Рулевая,'Рулевое управление LADA Granta',30.03.2013, 10:23,vess,'На стандарте кастер калиновский. Опять же, кастер чувствуется с набором скорости. На месте без разницы. Я на калине с кастером 2`45" два дня без эур ездил, пока датчик скорости не поменял. Не заметил я каких то лютых неудобств кроме парковки.'
30,Ходовая-Рулевая,'Рулевое управление LADA Granta',30.03.2013, 13:23,Borman,'такие трудности иногда бывают, когда в нормальную яму влетишь. после этого необходимо проехать на диагностику. мне, кажется, там вердикт вынесут.'
30,Ходовая-Рулевая,'Рулевое управление LADA Granta',14.04.2013, 00:36,flinter,'Сегодня ездил на дачу. До 100км/ч руль в нуле - тугой. Даже излишне. Хотя это позволяет поставить руль как надо и не держать его, а держаться Но после 110 - начинает кисель. Тяжесть исчезает полностью, и машина начинает рыскать, и на руль это все не отдает!!! Что делать? В четверг поеду на ТО. Грешу на колеса. Отпускать рейку - поможет ли?'
30,Ходовая-Рулевая,'Рулевое управление LADA Granta',19.04.2013, 22:05,phenom,'добрый вечер форумчане! проблема такая-при повороте руля влево-вправо слышатся стуки отдающие в район рулевой рейки,за тяги дёргал,ничего не услышал..пробег 10000,на гарантию забил.может подтянуть её? и как это сделать ,подскажите.'
30,Ходовая-Рулевая,'Рулевое управление LADA Granta',19.04.2013, 22:31,BMC2970,'Какой стук? Это когда докрутил до упора и в этот момент услышал "тук"? Так это нормально, только не держи руль в этом положении, чутку открути "взад", и ЭУРу будет "кайф"'
30,Ходовая-Рулевая,'Рулевое управление LADA Granta',19.04.2013, 23:38,vess,'phenom, стук рейки отдаёт в педали. Стук наконечников похож на рейку, но в педали не бьет. Стук карданчика как бы выше стука рейки и не отдет в педали'
30,Ходовая-Рулевая,'Рулевое управление LADA Granta',20.04.2013, 22:35,phenom,'спасибо,стук проявляется при вилянии рулем вправо-влево в диапазоне 90 гр.примерно,как будто что то встает на свое место...,отдается в рулевой вал,пробовал крутить и держать рукой вал в районе рейки..на сам корпус рейки тоже отдает....,при езде прямолинейной на любой дороге - тишина..'
30,Ходовая-Рулевая,'Рулевое управление LADA Granta',21.04.2013, 00:06,trek,'flinter, "спасибо конструкторам, спасибо технологам, отдельное спасибо испытателям". Все проблемы в рейке изначально неправильно отрегулированной. Отпустите ее, машина преобразится, прекратится таскание на скорости, руки уставать перестанут. ТОлько ИПГ об этом не говорите.'
30,Ходовая-Рулевая,'Рулевое управление LADA Granta',05.01.2012, 22:10,DP1980,'Вопрос ко всем обладателям LADA Granta: - Какой рулевой механизм установлен на серийных авто, - Сколько оборотов руля от "упора до упора" - Кто производитель электро-усилителя, - Каковы ощущения от рулевого управления.'
30,Ходовая-Рулевая,'Рулевое управление LADA Granta',21.04.2013, 00:25,flinter,'trek, Ездил к дилеру. Сказал им об этом. Они сделали развал схождение. Но это на маленькой скорости не помогло - все равно можно руль выставить налево и отпустить, так же как и направо. Буду пытаться через дилера это решить, все-таки надо их этому научить, а платить дополнительно - не хочу.'
30,Ходовая-Рулевая,'Рулевое управление LADA Granta',22.04.2013, 12:04,BIBERlist,'Ваш стук похож на неисправность опорного подшипника. Возмитесь рукой за пружину, а помошник крутит руль. Если почувствуете удары на руке 90%, что опорники. А подтягивать рейку не спешите, наоборот,как правильно сказал trek можно ослабить и желательно смазать, сняв торцевые колпачки.'
30,Ходовая-Рулевая,'Рулевое управление LADA Granta',26.04.2013, 15:28,Zik777,'Пробег 1500, движок 16кл. ABS.. Чувствуется вибрация усиливающаяся при нажатии на тормоз во время остановки, стоянки на светофорах? Обороты не скачут, рычаг коробки не дрожит!? Что это может быть, рулевая, АВS или???'
30,Ходовая-Рулевая,'Рулевое управление LADA Granta',26.04.2013, 15:54,vess,'Zik777, вибрация чего? На калиноплатформе вообще на холостых повышенная вибрация от агрегата. конструкция такая.'
30,Ходовая-Рулевая,'Рулевое управление LADA Granta',28.04.2013, 19:07,mikos,'flinter, помотайте рулём на заглушенном двигателе, колёса должны реагировать на малейшее движение рулём, если это не так , то рейка у вас перетянута. При движении это ощущается постоянным подруливанием в нулевой зоне, при этом чувствуется небольшое закусывание руля при смещении.'
30,Ходовая-Рулевая,'Рулевое управление LADA Granta',29.04.2013, 22:00,flinter,'mikos, нет подруливать не надо. До 100км/ч точно. А выше до развала - машина рыскает. После не пробовал еще негде.'
30,Ходовая-Рулевая,'Рулевое управление LADA Granta',06.05.2013, 12:47,Vova2012,'так может наоборот рейку подтянуть..износ знаете ли..небойсь на "щебёнке"дрыгается ...?'
30,Ходовая-Рулевая,'Рулевое управление LADA Granta',06.05.2013, 23:19,flinter,'Vova2012, Не дрыгается. Признаки перетянутости присутствуют. Добавлено через 20 секунд Правда на хреновой дороге - гремит.'
30,Ходовая-Рулевая,'Рулевое управление LADA Granta',07.05.2013, 00:37,trek,'Вот и тянут их бедных 30 лет скоро уже. При износе рейки от подтяжки толку никакого. Профилактически тянуть дураком надо быть, или автослесарем очень тупым. Впрочем ремни генераторные тоже ухитряются профилактически подтягивать, до запекания смазки в подшипниках. В результате всегда виновата машина, китайские подшипники, развал в стране, но никогда не кривые руки регулировшиков.'
30,Ходовая-Рулевая,'Рулевое управление LADA Granta',07.05.2013, 10:31,Antonio,'Всё правильно: на гранте стоят свои опорные подшипники и стойки. По поводу кастора: он увеличенный, как на норме так и на стандарте! Добавлено через 1 минуту Не надо ля-ля... На в вариантах с 124 и с 126 двигунами все ГУД Добавлено через 2 минуты колодки пробовал менять?'
30,Ходовая-Рулевая,'Рулевое управление LADA Granta',05.01.2012, 22:10,DP1980,'Вопрос ко всем обладателям LADA Granta: - Какой рулевой механизм установлен на серийных авто, - Сколько оборотов руля от "упора до упора" - Кто производитель электро-усилителя, - Каковы ощущения от рулевого управления.'
30,Ходовая-Рулевая,'Рулевое управление LADA Granta',08.05.2013, 20:03,Vova2012,'до переборки рейки можно чуть чуть подтянуть...один хрен потом перебирать...так шо не жалко... Добавлено через 41 минуту кстати а на этой рейке втулка только с правой стороны..?..шо то я давно их не разбирал...подзабыл...'
30,Ходовая-Рулевая,'Рулевое управление LADA Granta',08.05.2013, 21:07,BIBERlist,'Vova2012, товарищи Грантоводы и им сочувствующие, НЕ тяните бездумно рейки! В 99 случаях из 100 это делать вообще противопоказано. Поинтересуйтесь устройством механизма, а потом, может, придёт желание даже ослабить.'
30,Ходовая-Рулевая,'Рулевое управление LADA Granta',08.05.2013, 21:34,Vova2012,'А кто говорит без думно..втулки пластмассовые имеют свойства стачиваться..конешно это вряд ли продлит работу рейки но как временное средство от стука может помочь..потом на переборку..или есть такие у кого рейка пробегала...тыш 150..без переборки..'
30,Ходовая-Рулевая,'Рулевое управление LADA Granta',08.05.2013, 21:38,BIBERlist,'По вашей логике можно и клапана подзатянуть. Всё равно когда-то перебирать движок, а пока пусть шумит поменьше.'
30,Ходовая-Рулевая,'Рулевое управление LADA Granta',08.05.2013, 22:24,Vova2012,'жалко что рейку нельзя как клапана отрегулировать..а вот когда начнёте дорогу ловить и на каждой кочке трястись...тогда первым делом и подумаете ..что надо подтянуть..один хрен больше 70- 80 тыщь. и на переборку..можно конешно и новую но ..овчинка выделки не стоит..'
30,Ходовая-Рулевая,'Рулевое управление LADA Granta',09.05.2013, 19:20,TOSJ,'согласен! часто источником стука становится тарельчатая пружинка.Сам на калине и рейку регулировал и что только не делал пока эту пружинку не поменял и все. как бабки от шептали после замены прошла 55000 и так и продалась.'
30,Ходовая-Рулевая,'Рулевое управление LADA Granta',09.05.2013, 23:09,BIBERlist,'Верно. В рейке два источника стука. Усталость тарельчатой пружины и износ втулки. Ни то ни другое ни коим образом не исправить "подтягиванием рейки", только замена тар. пружины или втулки. Когда говорим "подтянуть реку". То мы прижимаем пару шестерня-рашпиль. Что приводит к быстрому необратимому износу этой пары. А дальше появляется тугой руль, закусывание в крайних положениях. Да, подтянув гайку, сдавливаем витую пружину до состояния цилиндра. Напрягаем через мерно весь механизм. И слушаем тишину. А через короткое время дребезг возвращается с новой силой.'
30,Ходовая-Рулевая,'Рулевое управление LADA Granta',10.05.2013, 10:18,Vova2012,'вощем история повторяется ...начиная с восьмёрки...блин стоко лет прошло а всё остаётся как было ...пружина....кстати какая на гранту подходит...ждёт нас тоже что и раньше ...переборка ...'
30,Ходовая-Рулевая,'Рулевое управление LADA Granta',10.05.2013, 18:24,alex 31,'Совершенно верно, что нужно смазать, т.к. сегодня сняв пыльники по торцам рулевой рейки смазки не было обнаружено ни грамма, может и на заводе это в порядке вещей для работы рулевой рейки не нужно добавлять смазки, но я решил все таки набить рейку литолом, хуже от этого не будет.'
30,Ходовая-Рулевая,'Рулевое управление LADA Granta',11.05.2013, 17:29,Vova2012,'Все форумы..начиная с восьмёрки по этому поводу повторяются...тарелочная пружина...втулки...подтяжка.. и как всегда у каждого своё средство лечения...но только тут появилось одно НО...эур...который тоже вносит свою лепту в это дело...'
30,Ходовая-Рулевая,'Рулевое управление LADA Granta',05.01.2012, 22:10,DP1980,'Вопрос ко всем обладателям LADA Granta: - Какой рулевой механизм установлен на серийных авто, - Сколько оборотов руля от "упора до упора" - Кто производитель электро-усилителя, - Каковы ощущения от рулевого управления.'
30,Ходовая-Рулевая,'Рулевое управление LADA Granta',13.05.2013, 00:09,Вятич,'Насколько помню, в рейке 2108 тарельчатой пружины не было. ЭУР появился ещё на Калине и позже Приоре, ничего нового.'
30,Ходовая-Рулевая,'Рулевое управление LADA Granta',13.05.2013, 00:44,VIRUS,'Заводом изготовителем закладывается смазка RENOLIT JP 1619,смазываеся рашпиль и низ вала где поджимная керамическая втулка и это самое главное.Но я бы не пихал литол уж и подавно шрус'
30,Ходовая-Рулевая,'Рулевое управление LADA Granta',13.05.2013, 07:07,Vova2012,'литол пихают не от хороший жизни ...а потому что нужную смазку не могут найти..а заводской там кот наплакал...цену на машину подняли а на смазку жмутся...'
30,Ходовая-Рулевая,'Рулевое управление LADA Granta',13.05.2013, 19:31,TOSJ,'На калине ШРУСа напихал на 2000. прошла до продажи 78000. только пружинку тарельчатую поменял.Так что вроде вреда не случилось!'
30,Ходовая-Рулевая,'Рулевое управление LADA Granta',14.05.2013, 11:32,alex 31,'Ну что же, не нашел фиола и пришлось смазать литолом, а про RENOLIT JP 1619 как то не встречал в теме ни на калине клубе ни здесь, что ее смазывают RENOLIT JP 1619 с завода. Вроде лучше сказали фиол, но его я не нашел, и пришлось смазать литолом.'
30,Ходовая-Рулевая,'Рулевое управление LADA Granta',14.05.2013, 12:16,trek,'Vova2012, ЭУР скрадывает перетяжку рейки. И машина плохо управляемая. и руль легко крутится. Трудно руль во вращение ввести, дальше абсолютно пустой и невесомый. Страшно на такой машине ездить.'
30,Ходовая-Рулевая,'Рулевое управление LADA Granta',14.05.2013, 14:41,Vova2012,'так это уже скорее люфт..и перетяжкой уже не пахнет...а наоборот...износом...думаю если перетянуть..то и эур мало поможет...'
30,Ходовая-Рулевая,'Рулевое управление LADA Granta',14.05.2013, 19:51,Vova2012,'кстати...про пустой и невесомый руль...калиноводы определяли что это эур....мудрили там чего то чтоб убрать люфт...так что не всё на рейку можно списать...'
