Code,Folder,Theme,Date,Time,Author,Message
30,Ходовая-Рулевая,'Стучит рулевая рейка',15.06.2013, 14:35,UnQBae4ka,'Сорри, если создаю похожую тему, но на форуме подобного не нашел Проблема с рулевой рейкой, Гранта Стандарт с ЭУР, стучит при езде по неровной дороге, походу брак рейки. Почитав в Инете понял что такая тема встречается у людей. Скажите кто-нибудь сталкивался с подобной проблемой и как ее лечить? Сколько стоит рулевая рейка с ЭУР? Если есть похожая тема, пришли плиз ссылку'
30,Ходовая-Рулевая,'Стучит рулевая рейка',15.06.2013, 15:14,moroz040203,'Не факт, что рейка стучит. Вот это читал, соседняя тема http://www.lada-granta.net/showpost....&postcount=498'
30,Ходовая-Рулевая,'Стучит рулевая рейка',15.06.2013, 15:22,Andrej1984,'стандарт с эур? это как?'
30,Ходовая-Рулевая,'Стучит рулевая рейка',15.06.2013, 15:35,alex 31,'А разве в стандарте есть ЭУР? Он комплектуется с нормы и выше.'
30,Ходовая-Рулевая,'Стучит рулевая рейка',15.06.2013, 17:58,rant,'UnQBae4ka, а с круиз-контролем проблем нет случайно?'
30,Ходовая-Рулевая,'Стучит рулевая рейка',15.06.2013, 18:40,Vova2012,'мужики чё накинулись на человека...вместо того чтоб ему помочь....выяснить чё да как...издеваетесь...сами что ли давно стали "спецами" вас любого можно так ...опустить... не хорошо это ...человек попросил помощи..вы чё и в жизне так ...ботаники ... Добавлено через 2 минуты зайдите в тему про рулевое управление....может там найдёте ответ...хотя это проблема давно уже всем известна...кому то помогла ...тарелочная пружина....'
30,Ходовая-Рулевая,'Стучит рулевая рейка',17.06.2013, 00:13,trek,'Vova2012, не лечат по фотографиям. Советы большим боком могут выйти советующему.'
30,Ходовая-Рулевая,'Стучит рулевая рейка',21.06.2013, 10:47,toshasibir,'всем привет! такая проблема извините,но в других темах не нашел.погнулся привод переднего колеса (который длиннее),в магазинах нет,но есть от десятки,которая на 2 см короче.Можно ли ее поставить?'
30,Ходовая-Рулевая,'Стучит рулевая рейка',21.06.2013, 21:04,Vova2012,'какой ещё привод? шрус что ль..?'
30,Ходовая-Рулевая,'Стучит рулевая рейка',21.06.2013, 23:49,kll,'Подозреваю, что вал привода'
30,Ходовая-Рулевая,'Стучит рулевая рейка',26.06.2013, 15:36,Slavent154,'И всё-таки, где там эта рейка подтягивается?'
30,Ходовая-Рулевая,'Стучит рулевая рейка',26.06.2013, 16:22,Vova2012,'посмотри тему ....рулевое управление лада гранта....там всё описано....'
30,Ходовая-Рулевая,'Стучит рулевая рейка',26.06.2013, 19:39,rolik1583,'Левый вал от 2110,правый 1118.'
30,Ходовая-Рулевая,'Стучит рулевая рейка',26.06.2013, 19:48,san 36,'надо на яму, с низу видно хорошо и подтянуть удобно.'
30,Ходовая-Рулевая,'Стучит рулевая рейка',01.10.2013, 10:26,fanarin,'Здравствуйте! Застучала рейка. Пробег 55000. Стук идет по рулю. При повороте влево,вправо тоже стучит. Разобрал рейку, косяков не нашли, все перебрали, поставили ремкомплект, шайбу ss-20. После ремонта ничего не произошло. Все так же грохочет(громко). Подскажите возможные причины? Наконечники и шаровые в порядке, опорники тоже. Что там еще может стучать-то???'
30,Ходовая-Рулевая,'Стучит рулевая рейка',01.10.2013, 11:05,vess,'fanarin, рулевой вал в каданах, например.'
30,Ходовая-Рулевая,'Стучит рулевая рейка',01.10.2013, 16:58,fanarin,'А что там может стучать? Крестовины?'
30,Ходовая-Рулевая,'Стучит рулевая рейка',03.10.2013, 20:25,Vova2012,'крестовины...шлицы ...ты его рукой прижми и руль покрути ...можно сделать самому ...'
30,Ходовая-Рулевая,'Стучит рулевая рейка',04.10.2013, 10:39,Rus,'Про корданчик рулевой вполне возможно. Помню была такая тема, как один на 2112 между карданчиками засунл плотный резиновый шарик и стуки прекратились.'
30,Ходовая-Рулевая,'Стучит рулевая рейка',04.10.2013, 13:37,Vova2012,'можно и так ..всё перекочевало с ....восьмёрки...ведь по хорошему взять...гранта...это восьмёрка в шоколадной обёртке..ну добавили...наворотов....эур... подушки...стеклоподъёмники. ...вощем ...фарша...а суть машины практически та же..да ещё запчастей от разных...модификаций...перед неприводных....напихали...и как в анекдоте...хоть завод мерса там построй..всё равно ваз...будет...место там такое...'
30,Ходовая-Рулевая,'Стучит рулевая рейка',28.04.2014, 09:52,PILOT711,'Я тоже думал, что на моей гранте рейка стучит. Оказалось, что это стучит тормозная трубка идущая к правому переднему колесу. Прямо под рулевой рейкой есть пластмассовый кронштейн (прикручен к моторному щитку) из которого трубка по каким-то причинам выскочила и долбит по этому кронштейну вибрируя на неровностях. Вставить обратно трубку мне не удалось просто надел на трубку кусочек шланга (который уперся в кронштейн) и стук исчез.'
30,Ходовая-Рулевая,'Стучит рулевая рейка',28.04.2014, 17:13,nikolug,'разве есть "стандарт с ЭУР"?'
30,Ходовая-Рулевая,'Стучит рулевая рейка',28.04.2014, 18:51,www-shurik,'На восьмёрке (когда не было ЭУР) была резиновая муфта. Т.к. ЭУР влепили под руль, то муфта ему не нужна - вот с той муфтой не чего там не стучало (я про карданчики).'
30,Ходовая-Рулевая,'Стучит рулевая рейка',28.04.2014, 21:01,PILOT711,'Разницы нет "стандарт", "норма" или "люкс" болячки у всех одинаковы просто чем больше опций, тем больше проблем. Добавлено через 11 минут Крестовины поставили не для регулировки руля, а в первую очередь для безопасности при ударе в лобовую.'
30,Ходовая-Рулевая,'Стучит рулевая рейка',28.04.2014, 23:56,www-shurik,'Могли бы муфту и оставить тогда после крестовин Добавлено через 21 секунду На многих иномарках она стоит Добавлено через 4 минуты Просто электроуселителя руля нет в комплектации стандарт, там редуктор рейки на большее число оборотов. А в вопросе именно "комплектация стандарт с ЭУР" - т.е. такой комплектации не существует.'
30,Ходовая-Рулевая,'Стучит рулевая рейка',29.04.2014, 08:44,PILOT711,'Я знаю, что нет, но это совсем не значит, что ЭУР на данном автомобиле нет. Если у меня "норма" то это не значит, что нет кондиционера, мультимедиа, парктроника, ПТФ, датчика дождя, света, датчика температуры внешней и в салоне, зад.стеклоподъёмники, подогрев передних и задних сидений и т. д. Всё это я установил сам. И что мешало товарищу установить ЭУР на стандарт, просто он выразился так.'
30,Ходовая-Рулевая,'Стучит рулевая рейка',29.04.2014, 09:07,www-shurik,'Это просто введение в заблуждение - он либо название комплектации перепутал, либо ЭУР просто так преплёл и уж совсем маловероятно, что он так теперь стал называть совою машину после модернизации и самостоятельной установки ЭУР. Вы же не пишите так, чтобы было не понятно какая именно машина у вас приписывая к её названию всё что туда поставили. От этого название комплектации авто никак не меняется!'
30,Ходовая-Рулевая,'Стучит рулевая рейка',26.05.2014, 12:09,agent,'застучала на 28000, правая тяга особенно, подтянули, пока норм, но чуствую опять застучит скоро, замена после 2 подтяжек.'
30,Ходовая-Рулевая,'Стучит рулевая рейка',26.05.2014, 13:02,BIBERlist,'agent, Если просто каждый раз подтягивать, то скорой замены не избежать. А вот если смазать, сняв резиновые колпачки в торцах, то механизм дольше поработает.'
30,Ходовая-Рулевая,'Стучит рулевая рейка',28.05.2014, 21:11,agent,'Пока на гарантии , дилер пусть и решает что лучше делать)'
30,Ходовая-Рулевая,'Стучит рулевая рейка',28.05.2014, 22:08,Mishanya,'Да дилерам плевать, ничего они решать не будут, если докажешь, что рулевая рейка неисправна-тупо заменят её и ничего крутить и смазывать не будут, а не докажешь-отправишься в пешее эротическое путешествие. Я на своей прямо с новья ослабил рейку, сейчас пробег чуть более 16 тыс., недавно начала постукивать, видать сильно ослабил, подтянул капельку, стук пропал, смазка в рейке есть с завода, к дилерам по этому поводу обращаться не собираюсь, т.к. ничего кроме замены рейки там не предложат, а это опять надо её самому регулировать, а то ещё и бракованная или не смазанная попадётся, короче не совсем радужные перспективы.'
30,Ходовая-Рулевая,'Стучит рулевая рейка',29.05.2014, 11:20,agent,'ну вот как заменят, тогда и будем смазывать'
30,Ходовая-Рулевая,'Стучит рулевая рейка',29.05.2014, 13:01,BIBERlist,'agent, Может так случится, что во время гарантийного срока рейку не заменят, а подтяжка износит её хорошенько. И когда гарантия кончится придётся менять за свои деньги. Я с новья отпустил, смазал, сняв колпачки (хомутики 3 руб+ лилол24 100 руб). А пришёл я к необходимости смазать рейку, когда ездил на Калине. Начал руль подклинивать и скрипеть. Поменял опорники, шаровые- не помогло. Потом разобрал рейку, ни чего не менял просто смазал и собрал. И понял, что даже на новой не было такого приятного руления.'
30,Ходовая-Рулевая,'Стучит рулевая рейка',30.05.2014, 10:14,Mishanya,'Проще всего будет смазку проверить перед заменой, да и смазать если что. Так с умом надо подтягивать.'
30,Ходовая-Рулевая,'Стучит рулевая рейка',30.05.2014, 23:02,BIBERlist,'Совершенно справедливо. Но подавляющее большенство пользователей подягивают без ума. Нужно понимать, что над регулировочной гайкой стоит витая пружина. И если сильно затянуть, то витки этой пружины сомкнутся, и получившийся цилиндр будет черезмерно подпирать рейку к шестерне- результат скорый износ. Поэтому, если поизносилась втулка, нельзя устранять стук затяжкой гайки!'
30,Ходовая-Рулевая,'Стучит рулевая рейка',31.05.2014, 23:24,PILOT711,'Чт0бы рулевая рейка не стучала нужно вставить самодельную опорную втулку по всей длине рейки. И забудете про стук.'
30,Ходовая-Рулевая,'Стучит рулевая рейка',01.06.2014, 21:34,Mishanya,'Гениально! И можно будет ездить до тех пор, пока шестерня мимо рейки не станет проворачиваться! Только вот рейка будет туго ходить, но для этого есть эур, а в ноль руль вообще перестанет возвращаться, но это тоже мелочи.'
30,Ходовая-Рулевая,'Стучит рулевая рейка',02.06.2014, 22:41,PILOT711,'В таком случае музыку громче и вперёд. Ремонт и замена на обычные существующие детали рулевой рейки бесполезен. А полная замена решает проблему не надолго.'
30,Ходовая-Рулевая,'Стучит рулевая рейка',17.07.2014, 23:51,Sever808,'Парни.Подскажите плиз,че за хрень такая?Брякает что то в рулевой.Не рейка 100%.именно вот где то в салоне.Не стук,а такое бряканье как будто гайка банке консервной болтается.30 минут гимнастикой занимался лежа вниз головой щупая карданчики.Карданчики люфтят,но от них глухой стук,а это толи в эуре,то ли в соединении где эур и карданчик соединяется.Не пойму.достала эта хрень хоть продавай,уже сегодня на ниву из-за отчаяния хотел махнуться.Просто за...ло это стук стук.И немогу найти где стучит.Машина с усилителем MANDO.Стучит не рейка точно,ибо когда прощупывал карданы,малой амплитудой качая руль,стук начинается в момент когда вращением руля только выбираешь люфты карданчика,рейка не подвижна остается.'
30,Ходовая-Рулевая,'Стучит рулевая рейка',17.07.2014, 23:59,sergeygen,'Могут опорники брякать,а могут и амортизаторы как у меня когда прогреются.'
30,Ходовая-Рулевая,'Стучит рулевая рейка',18.07.2014, 08:37,Sever808,'Да нет,стук именно вот из рулевой.Бесит жутко.Не могу найти откуда. ((('
30,Ходовая-Рулевая,'Стучит рулевая рейка',18.07.2014, 12:22,www-shurik,'Тоже на дороге (где гравий втоптали в землю) есть стук. Но т.к. 95% - у меня асфальт, я пока не искал этой причины. По слышимости выскоких частот - это явно внутри салона. Но я склоняюсь к мысли что это всё таки карданы (либо редуктор ЭУРА - хотя я даже не знаю что там за редуктор, так к слово вспомнил про ЭУР). Даже если амплитуда выбрана натягом неровность дороги может отбрасывать колесо и просто вибрация с колёс (отскок резины от боковых камней по обе стороны колеса) может создавать ударные нагрузки в обоих направлениях. Муфту бы резиновую поставить вместо кардана нижнего (как на 21083 было).'
30,Ходовая-Рулевая,'Стучит рулевая рейка',18.07.2014, 19:09,Sever808,'Дай бог "здоровья" вазовским конструторам и инженерам.они хоть сами ездили на том что делают?а муфта как на 8ке весчь.Думаю карданчик от 2110 приспособить,если другой причины не найду.ща опять в деревню по гравийке фигарить ((( Добавлено через 43 минуты просочился ща под руль,опять все подергал,ниче не понял,ну кроме кардана гриметь нечему.Буду наверн карданчик либо 10й подгонять,либо втулить родной'
30,Ходовая-Рулевая,'Стучит рулевая рейка',20.07.2014, 21:48,Sever808,'Походу стучит ЭУР. (( буду копить на безредукторный Калужский (( стучит походу в зацеплении шестерня-червяк.15р на сайте завода усилок (('
30,Ходовая-Рулевая,'Стучит рулевая рейка',20.07.2014, 22:58,Mishanya,'Sever808, если при движении на высокой скорости по дороге не швыряет-забей, главное, чтобы управляемость не страдала, карданчики эти почти все гремят на щебёнке, и это болезнь многих иномарок, не говоря уже про ВАЗ.'
30,Ходовая-Рулевая,'Стучит рулевая рейка',24.08.2014, 23:59,PILOT711,'Вот и у меня на 49 тысячи км. застучала рулевая рейка. Устранить путём регулировки не удалось, пришлось ремонтировать. При разборке обнаружил заводской брак, на втулке рейки вместо двух демпферных колец стояла только одна. При не аккуратном извлечении втулки сломал один ус. Поисками новой втулки не занимался, а выточил из фторопласта самодельную. Сейчас 52000 рулевая как новая. КРАСНОЙ стрелкой отмечен обломанный ус фиксатора втулки. ЖЁЛТОЙ отсутствие демпферного кольца. ЗЕЛЁНОЙ уцелевший ус фиксатора втулки.'
30,Ходовая-Рулевая,'Стучит рулевая рейка',10.09.2014, 19:25,veles,'То же заметил по гравийке есть какие-то подбрякивания иногда, да и по фиг. Управляемость то нормальная, люфта нет. Вот когда уже будет греметь как на калине бывшей, тогда думаю стоит задуматься. Машина изначально дешёвая, есть косячки, на которые можно закрыть глаза, относительно цены и других достоинств машинки'
30,Ходовая-Рулевая,'Стучит рулевая рейка',18.09.2014, 22:36,сан,'Привет всем. Я посоветоваться , стук в рейке как и у многих, решил немног попробывать подтянуть рейку. не идёт в перёд немного отпустил очень туго назад.пробую опять поджать не идёт даже на старое место. как заклинила на резбе,а стук стал ещё больше, как быть кто подскажет?'
30,Ходовая-Рулевая,'Стучит рулевая рейка',19.09.2014, 00:39,prugina,'После 50000 км частое явление.У меня на Калине было-замена рейки-лучьший вариант.'
30,Ходовая-Рулевая,'Стучит рулевая рейка',19.09.2014, 06:59,www-shurik,'Регулировочная гайка накернена - обычный ключт для регулировки у меня сломался. Приобрёл головку 8гранную для развинчивания рулевой рейки, ей же можно крутить эту гайку. Правда для этого пришлось снять хомуты крепления рейки к кузову и потянуть за рейку, чтобы засунуть туда эту головку. Примерно такая головка, только вторая грань шестигранная под ключ на 24 (а тут на фото только 2 грани, не получится крутить не снимая рейку с кузова) Ключ был такой, там слабо приварено соединение - чисто для регулировки и он не смог сдвинуть кернение. А сам по себе шум как оказалось толи от крестовин внутри салона, то ли от ЭУР - рейка при вращении рулём никаких шумов не выдавала. Наличие смазки черезе пыльник проверил - всё было нормально и натяг вернул как и было.'
30,Ходовая-Рулевая,'Стучит рулевая рейка',19.09.2014, 21:13,сан,'Я тоже ключ сломал. У меня восмигранник на 24. Заварил усилил но ещё не пробывал.Если не пойдёт буду снимать рейку и на снятой крутить. У меня СТАНДАРТ без ЭУРА и стук именно из рейки. Потому как отпустил он усилился.'
