Code,Folder,Theme,Date,Time,Author,Message
0,Отзывы,'Дрожь руля.',18.12.2019, 10:50,serg280976,'Имеется Рапид 2019г, Двигатель 1.6, 90лс. Пробег 6000км. Последнее время заметил небольшую мелкую дрожь на руле и мне кажется стал сильнее слышать звук двигателя в салоне. Даже на холостом ходу. Дрожь какая то нестабильная, то бывает на холостом ходу, то при движении и разная по силе. Так что связать с балансировкой колес не могу. Честно говоря не знаю, так было изначально или появилось т.к. пересел на Рапида с Ваз21099 и поначалу все для меня было хорошо, а теперь или привык или действительно. Вчера вечер посвятил выяснению причины. Вибрация на холостом ходу практически полностью проходит после прогрева двигателя. Далее при нажатии газа, вибрация на руле увеличивается, потом почти прекращается при 2500об мин, а далее опять возникает. Во время поездки вибрация ощущается как от дороги, так и от двигателя, т.к. катясь на нейтрали, дрожь заметно меньше. Вообщем двигатель заметно вносит вибрацию . Как избавиться?'
0,Отзывы,'Дрожь руля.',07.02.2020, 09:55,Александр_С,'Ходил в салон. На новых машинах тоже самое.'
0,Отзывы,'Дрожь руля.',08.10.2020, 13:51,sarge,'У меня тоже с автомобилем проблем целая куча. Мало того, что гул движка постоянно слышен, да ещё и со сцеплением неполадки какие-то. Время выберу, надо будет отремонтировать всё это дело. После того как приведу в порядок авто, собираюсь техосмотр онлайн http://diagcard.pro/ пройти, ибо срок действия нынешнего к концу уже подходит. А вы свой ТО тоже онлайн оформляли или нет?'
0,Отзывы,'Дрожь руля.',17.12.2020, 23:46,lectneenby,'В случае приобретения автомобиля с браком понадобиться консультация юриста. Не стоит ругаться с продавцом - просто обратитесь за юридической помощью.'
0,Отзывы,'Работа охранником',25.11.2020, 11:40,Тарасов Коля,'Кто работает охранником? Тяжелая работа? Хочу устроиться? Форму нужно самому покупать?'
0,Отзывы,'Работа охранником',25.11.2020, 15:01,Леха Жуковский,'Конечно, тяжелая работа, я Вам скажу, точнее люди тяжелые в наше время. Постоянно всем недовольны, да еще и воруют. Но речь конечно не об этом. Могу посоветовать магазин Мосдеф, у них как раз есть каталог рабочей одежды , я видел там форму охранника. Вы посмотрите, может еще что-то, понадобится, там есть много чего для людей разных профессий.'
0,Отзывы,'Работа охранником',26.11.2020, 16:03,Тарасов Коля,'Спасибо большое за совет. Мне как раз подошёл этот магазин. Я не только робу выбрал, еще и ремень и ботинки.'
0,Отзывы,'Мотор потряхивает на холостых. Мигает чек.',16.11.2020, 21:23,Skodavoda123,'Доброго времени суток, дорогие форумчане. Столкнулся со следующей проблемой. Около месяца назад после ночи начинаю заводить автомобиль, прогреваю его минут 10 до 60 градусов и начинаю потихоньку стартовать. Внезапно, при нажатии педали газа, обороты начинают прыгать, машина ведёт себя неадекватно, мотор начал жутко вибрировать. Начал мигать чек. Машину заглушил, завёл снова, чек больше не мигал, но мотор всё ещё хорошенько так потряхивало. В движении этого не чувствуется, но на холостых очень жестко трясся мотор. Первое, что пришло мне в голову — это свечи. Заменил в этот же день, мотор стало потряхивать намного меньше, вибрации почти нет. Знакомые говорят, чё ты паришься, он так и должен работать. Но я то чувствую, что раньше он так не работал! В общем, пока проблему отложил на второй план. Прошло ещё около двух недель, я накатал за это время около 3-4 тысяч км. Опять на утро начинаю заводить машину, прогреваю, начинаю движение и снова начинает мигать чек. Мотор жутко трясет, старая история. После того, как заглушил машину и снова завёл, чек больше не мигает. Когда машина полностью прогревается, то мотор приходит в более менее нормальное состояние, потряхивает, вибрирует на холостых, но в движении показывает себя как обычно, без каких либо нареканий. Вот уже около недели катаюсь на автомобиле, заводится без миганий чека и без жестких вибраций. Диагноста выявила следующие ошибки. В чём может быть дело?'
0,Отзывы,'Девушки',15.11.2020, 22:55,Вася Рыбаков,'Какие вам по вкусу?'
0,Отзывы,'Девушки',15.11.2020, 23:16,Марк Иванченко,'Вот я люблю блондиночек, вот они меня капец как заводят. Особенно привлекает давалка http://prostitutkimoskvy.run/vika-36/ Она вообще огонь, советую воспользоваться её услугами'
0,Отзывы,'Элитные малышки',15.11.2020, 22:55,Вася Рыбаков,'Где снять таких для развлечений?'
0,Отзывы,'Элитные малышки',15.11.2020, 23:15,Марк Иванченко,'Так вот лови сайт https://prostitutkimoskvyx.net/price3500-5000/ там ты сможешь снять элитных и страстных девочек для незабываемого секса и готовы на любые эксперименты. Вот мне они вообще агонь'
0,Отзывы,'Банька и девки',15.11.2020, 22:58,Вася Рыбаков,'Хочу расслабиться и пошалить немного. Друзья предлагают в баньку отправится, но без девок никак.'
0,Отзывы,'Банька и девки',15.11.2020, 23:15,Марк Иванченко,'Согласен с тобой, через часик вам уже скучно станет, уверен. Так что лови сайт https://prostitutkimoskvylist.info и выбирайте вместе этих страстных львиц для экспериментов, вот реально с ними вы круто проведёте своё время'
0,Отзывы,'Люблю стройных',15.11.2020, 22:59,Вася Рыбаков,'Вот люблю стройных девочек, прям не могу. Только где найти опытных?'
0,Отзывы,'Люблю стройных',15.11.2020, 23:15,Марк Иванченко,'Тоже люблю таких малышек и нашел свою фаворитку и это https://prostitutkimoskvyhot.info/catalog/alisa-48/ Она вообще ураган, вот серьезно, с ней можно воплотить все свои желания в реальность'
