Code,Folder,Theme,Date,Time,Author,Message
0,Отзывы,'Омывающая жидкость: как сделать из летней зимнюю',24.10.2016, 12:33,Dr.Dev,'Езжу на АМ второй год и заметил, что за сезон не успеваю потратить залитую в бачок летнюю омывайку — прошлый раз ее наверное полчаса сливал, чтобы залить зимнюю. Теперь надвигаются холода, а я знаю, что бачок полон летней, она почти не тратилась. Так вот я и думаю: нельзя ли просто подлить туда какой-нибудь раствор, чтобы летняя стала зимней, хотя бы до -10?'
0,Отзывы,'Омывающая жидкость: как сделать из летней зимнюю',24.10.2016, 19:12,Александр Смирнов,'можно. добавить спирта или водки паленой накрайняк чем больше спирта(неважно--этанол, метанол, изопропил) тем ниже температуру держит'
0,Отзывы,'Омывающая жидкость: как сделать из летней зимнюю',24.10.2016, 23:48,clx,'А я как раз недавно взял концентрат для этой цели. Табличка есть на стикере: "пропорция --- температура замерзания". Не забуду - сфоткаю.'
0,Отзывы,'Омывающая жидкость: как сделать из летней зимнюю',25.10.2016, 02:19,Dr.Dev,'Спасибо, наверное это как раз то, что нужно.'
0,Отзывы,'Омывающая жидкость: как сделать из летней зимнюю',29.10.2016, 20:52,Стрельников Артем,'Да, стакан водяры туда вылить.. в лучше постоять 10 минут, вылить всю на стекло.., и зимней залить. А то ни дай Бог в трубках замёрзнет, в нужный момент не брызнет .'
0,Отзывы,'Треск при остановке',05.04.2016, 14:07,Nikita,'Добрый день. Машина: Шкода рапид 1.6 АПК, 2015 года, пробег 1000+км При остановке (даже сои проехал с км) слышен треск из под днища, как будто часы тикают. Я так понимаю это остывает выпускной коллектор, но нормально ли это? И это будет постоянно? Мб кто-то сталкивался с подобным?'
0,Отзывы,'Треск при остановке',05.04.2016, 14:11,clx,'Все верно. Остывает так. Нормальное явление'
0,Отзывы,'Треск при остановке',23.10.2016, 14:13,urman,'Вопрос- пробег 5000 т км. после любой поездки глушу двигатель и выхожу на улицу ( и в салоне слышно) ЩЕЛЧКИ ! Понимаю остывает выхлопной тракт. открываю капот дотянуться могу только до катализатора (палкой деревянной прикоснулся.... она минуты не прошла ЗАДЫМИЛАСЬ Сам до красна не раскалён :smile: Сколько было новых машин не было такого ни на одной авто ( по работе очень много новых перегонял. но воняла на каких то обгорало что-то) но чтоб постоянно щёлкало или пять тысяч не показатель? на 20 т.км тоже будет треск и щёлкать?'
0,Отзывы,'Треск при остановке',23.10.2016, 17:10,Dikey2000,'Не обращайте внимания,оно постоянно петрескивает, после 20000км. перестал замечать есть звук этот или нет.'
0,Отзывы,'горит EPC + "Система контроля ОГ"',10.10.2016, 20:06,URI,'При повернутом ключе зажигания(машина НЕ заведена) горят лампы желтым EPC и система контроля ОГ. При заводе двигателя сразу гаснут.После при движении не появляются.машина новая ,1500 пробег ,дв.1.6 .90 л.с. Подскажите что может быть или так и должно быть. До сервиса далеко.кстати не в тему ,может ,кто знает .куда делся салон в Северодвинске.'
0,Отзывы,'горит EPC + "Система контроля ОГ"',10.10.2016, 21:38,serv,'URI - Тепличный проезд, д. 4, Северодвинск - «АВТО БРАВО С» http://www.skoda-avto.ru/dealer'
0,Отзывы,'горит EPC + "Система контроля ОГ"',12.10.2016, 20:06,URI,'Подниму темку.ни кто ни чего не посоветовал.'
0,Отзывы,'горит EPC + "Система контроля ОГ"',12.10.2016, 22:46,serv,'http://www.skoda-club.org.ua/forum/s....php?tid=74150 http://forum.skoda-club.ru/viewtopic.php?f=25&t=115938'
0,Отзывы,'Проблема с прикуривателем',06.10.2016, 22:29,EvgenyJr,'Сталкивался ли, кто-нибудь? Перестали работать две зарядки для смартфонов. Думал умер прикуриватель, но сам прикуриватель работает без нареканий. Гнездо, внутри, не рассматривал еще, некогда пока.'
0,Отзывы,'Проблема с прикуривателем',07.10.2016, 18:46,Andrewhowk,'Проверьте предохранители внутри зарядок. они под центральным электродом - он выкручивается.'
0,Отзывы,'Сигналка в Рапид',02.10.2016, 16:33,cremaster,'Всем здоровья! Кто нибудь занимался самостоятельно установкой сигналки на рапид, охранкой как то с трудом это зовется. Если да, то какая лучше вяжется со штатной, есть ли подводные камни? По сути нужна лишь обратная связь при вандальных действиях хулиганья. Опыт небольшой есть, ставил себе Pantera SLK500 на 099, и Starline B9 на приору. Особых камней там не обнаружил, во всяком разе под рукой были принципиальные схемы электропроводки. Хорошо бы с фотоотчетом. Спасибо!'
0,Отзывы,'Сигналка в Рапид',02.10.2016, 18:17,cremaster,'Поспешил с темой. Не очень подробный, но вполне понятный отчет нашел. http://www.rapidclubs.ru/forum/thread382.html'
0,Отзывы,'складывание зеркали много еще чего',29.09.2016, 23:57,Дмитрий123321,'приветствую участников форума ! ответьте люди добрые ! 1 как включить складывание зеркал , комплектация амбишн, 2014 год , жму секунд 5 -10 на брелок не закрывается , машину покупала жена , естественно не проверила ( 2 где располагается блок предохранителей и какой отвечает за прикуриватель ? 3 если машина выключена то прикуриватель все равно работает ? - можно отключить ?'
0,Отзывы,'складывание зеркали много еще чего',30.09.2016, 09:00,Dikey2000,'1.Если на крутилке регулировки зеркал нет положения сложить зеркала,то зеркала складываются руками.2.Берём РЭ и читаем.3.Прикуриватель работает всегда,т.к. в З.Ж.нет положения АСС,отключить можно переделкой проводки.'
0,Отзывы,'складывание зеркали много еще чего',30.09.2016, 13:33,Rapid_567,'А кто-нить знает - в ВСМ можно отключить?'
0,Отзывы,'Вибрация на холостую , я новичок',29.09.2016, 13:07,Дмитрий123321,'Приветствую всех участников форума !!! я новичок , и не очень дружу с авто ... на холостом ходу без движения присутствует вибрация , пробег 24000 авто 2014 года , машина только что куплена, при покупке видрации не заметили ! что это ? это норма ?'
0,Отзывы,'Вибрация на холостую , я новичок',30.09.2016, 10:11,Hast,'Привет, уточни какой двигатель. Тут было обсуждение двигателя САХА 1.4 TSI проблема в форсунках, вернее в их засорении.'
0,Отзывы,'Прикуриватель',21.09.2015, 20:22,@MPER@TOR,'Подскажите пожалуйста, а можно ли сделать так, чтобы прикуриватель отключался вместе с выключением зажигания?'
0,Отзывы,'Прикуриватель',21.09.2015, 21:11,anicha,'Да, разрываете цепь и реле ставите в промежутке Примерно тоже самое, что я описал в этой теме'
0,Отзывы,'Прикуриватель',21.09.2015, 21:36,@MPER@TOR,'Благодарю!!!'
0,Отзывы,'Прикуриватель',13.11.2015, 13:38,denis.berezin,'Приает всем, подскажите пожалуйста! Сгорел предохранитель прикуривателя, когда ставлю новый опять перегорает, что случилось не знаю, может кто сталкивался?'
0,Отзывы,'Прикуриватель',14.08.2016, 21:08,Айдар,'не стал работать прикуривытель, залез в предохранители, а там 47 предохранитель отвечающий за прикуриватель нет, ну купил, поставил и не работает , что может быть ?'
0,Отзывы,'Прикуриватель',14.08.2016, 21:47,Dikey2000,'А до того как :-"не стал работать прикуривытель",он работал?'
0,Отзывы,'Прикуриватель',14.08.2016, 23:26,Айдар,'да все работало, машине 3 мес, подключал антирадар вероятно он дал "сбой" т.к разъем на нем разболтался может закоротил, а вообще как бы мог без предохранителя работать )) если под номером 47, до этого Логан был тоже менял без проблем скрепки, монеты в прикуриватель замена помогала, ну к ОД в крайнем случае, странно конечно ('
0,Отзывы,'Прикуриватель',15.08.2016, 01:47,Dikey2000,'Надо в инструкции посмотреть,может ещё какой ни будь предохранитель,за прикуриватель отвечает.'
0,Отзывы,'Прикуриватель',16.08.2016, 10:12,Айдар,'с 2015 г. на наших машинах другие тех.хар-ки , ну и предохранители в других местах. Менять 44 предохранитель и все заработало'
0,Отзывы,'Прикуриватель',27.09.2016, 14:20,Nikkizvuk,'Подскажите пожалуйста, как снять прикуривателя? Как вы его вытаскивали?'
0,Отзывы,'Загорелся чек эндж машина на гарантии',25.07.2016, 09:55,Hast,'Всех приветствую Машина Рапид с DSG пробег 50500, еще на гарантии Загорелся чек эндж поехал к официалам взяли 2500 сказали плохой бензин и свечи менять. Т.О. 45000 делал у них же про свечи не говорили. Обнулил чек эдж на след день опять загорелся.'
0,Отзывы,'Загорелся чек эндж машина на гарантии',25.07.2016, 12:11,EvgenySh,'Не понятно о чем запись. Хоть бы код ошибки написал'
0,Отзывы,'Загорелся чек эндж машина на гарантии',25.07.2016, 12:18,Hast,'Горит желтым огнем на панеле значек двигателя ( чек эндж) я не знаю какой код у этой ошибки.'
0,Отзывы,'Загорелся чек эндж машина на гарантии',26.07.2016, 08:23,Rapid_567,'Посмотри заказ-наряд на ремонт, там должно быть описано результаты диагностики. Код ошибки или описание должны быть описаны максимально информативно для клиента. В итоге - свечи менял? На повторную диагностику поедешь?'
0,Отзывы,'Загорелся чек эндж машина на гарантии',26.07.2016, 09:49,Hast,'Да записался на повторную Они нписали рекомендуем заменить свечи и промыть систему впрыска. Вырос расход бензина, машина дергается на ходу, при холостом пуске сильно троит. Но повторяю приходил Т.О у них же это Внуковский центр, на 45000 про свечи не заикнулись хотя должны были смотреть, деньги по крайней мере взяли. Сейчас 50500 на одометре. Слышал что несколько машин с такими симптомами уже были после меня.'
0,Отзывы,'Загорелся чек эндж машина на гарантии',27.07.2016, 08:14,Rapid_567,'Ну это в корне неверно. Описание проблемы обязательно должно быть, на основании чего они делают рекомендации?? А по второму моменту - нужно всегда уточнять, вернее даже не уточнять, а настаивать на проведении работ согласно регламенту, указанному в сервисной книжке. Тут уж владелец сам должен следить, за тем что с его а/м делают.'
0,Отзывы,'Загорелся чек эндж машина на гарантии',27.07.2016, 10:13,Hast,'Не очень понял в чем я виноват и что мне теперь делать? Ведь они теперь мне сделают еще какую то диагностику. возможно это бензонасос как они сказали, вот только вернут ли деньги за пред идущую не знаю, завтра выясню. Записан на четверг.'
0,Отзывы,'Загорелся чек эндж машина на гарантии',28.07.2016, 10:11,Hast,'Сказали поменять свечи и обязательно промыть систему впрыска. И после этого 99% симптомы пропадут.'
0,Отзывы,'Загорелся чек эндж машина на гарантии',28.07.2016, 17:42,Rapid_567,'Так нужно было и поменять сразу у них свечи и провести рекомендованные работы. А все-таки - код ошибки уточнил?'
0,Отзывы,'Загорелся чек эндж машина на гарантии',29.07.2016, 09:48,Hast,'У них больше делать ничего не буду. Пропуски в зажигании говорят, код не сказали. Свечи поменяю в субботу, мыть систему впрыска не буду. Отпишу если интересно как ведет себя после замены. Сейчас появилась яма на 2000 оборотах, если педаль нажать на половину (хода педали) машина не реагирует никак. Расход вырос, при холодном пуске сильная детонация примерно полминуты, до снятия свечей этого не был просто горел чек.'
0,Отзывы,'Загорелся чек эндж машина на гарантии',29.07.2016, 12:00,Rapid_567,'А пропуски по одному или нескольким цилиндрам? Тоже важно. Похоже не в свечах дело. Да, в такой сервис лучше не ногой, ни колесом!!!'
0,Отзывы,'Загорелся чек эндж машина на гарантии',29.07.2016, 20:47,Dikey2000,'Я стесняюсь спросить, Вы всё к дилеру ездите?'
0,Отзывы,'Загорелся чек эндж машина на гарантии',01.08.2016, 12:09,Hast,'Да езжу к дилеру машина на гарантии еще. Свечи поменял, не помогло, буду мыть систему впрыска. После гарантии нет желания к ним ездить, но еще не решил, электронная книжка заполняется только через них, нужна ли она после гарантийного периода не понял.'
0,Отзывы,'Загорелся чек эндж машина на гарантии',01.08.2016, 20:15,Александр Смирнов,'[QUOTE=Hast;9662 Вырос расход бензина, машина дергается на ходу, при холостом пуске сильно троит. [/QUOTE] у меня, ещё на калине, так было. причина--наб...ся датчик кислорода пробег тоже был в районе 45-50 тыщ'
0,Отзывы,'Загорелся чек эндж машина на гарантии',02.08.2016, 10:50,Hast,'Звонил в несколько сервисов на предмет промывки, у всех стоят с такой проблемой по несколько машин. Что то с топливом в Москве.'
0,Отзывы,'Загорелся чек эндж машина на гарантии',02.08.2016, 12:48,EvgenySh,'Дело не в топливе, а в том что с такой неисправностью очень легко разводить на деньги даже официалам. Вам показали свечи, в каком они были состоянии ? К тому же как я понял у Вас 1,4 с турбиной, так вот скорее всего дело в ней, неправильно работает наддув и из-за этого троение. Катушки зажигания местами меняли ? В одном цилиндре пропуски или во всех ? Давление в цилиндрах на холодную мерили ? Троение на холодную может говорить об залегании колец или их разрушении. Причин масса, диагностический сканер показывает только следствие этих причин'
0,Отзывы,'Загорелся чек эндж машина на гарантии',02.08.2016, 13:04,Hast,'Свечи показали, не скажу что очень грязные были, но поменял. Не помогло. А причем тут наддув при запуске,да троит на холодном пуске примерно 30 сек, пропадает мощность при езде на 7 передаче на 2000 оборотах, если педаль нажимать плавно, машина не реагирует, если в пол, то фигачит как раньше но это турбина начинает помогать на 2800 оборотах. Машина прошла 51000 вовремя обслуживалась за маслом следил не думаю что так ужасно все как вы описали, по крайней мере надеюсь что промывка поможет. Уже потратил на диагностику, свечи + (промывка записался), если это не оно то я впаду в отчаяние. Это первая моя машина которая требует вложений на гарантийном периоде.'
0,Отзывы,'Загорелся чек эндж машина на гарантии',03.08.2016, 12:57,Hast,'Сделал сегодня промывку впрыска, помогло. Расход стал в норме машина пока едет нормально, не троит при запуске. На сервисе сказали что это проблема нарисовалась месяц назад, просто валом повалили.'
0,Отзывы,'Загорелся чек эндж машина на гарантии',03.08.2016, 16:26,Rapid_567,'Каким образом делал промывку - расскажи. Всю топливную магистраль, от бака? Фильтр менял?'
0,Отзывы,'Загорелся чек эндж машина на гарантии',03.08.2016, 16:40,Hast,'Нет только "Инжектор" Отсоединили топливный шланг под капотом подсоединили от аппарата залили в него спец жидкость поставили таймер на 15 мин и так два раза. Свечи не снимали фильтра тоже не меняли. Официалы делают также но дороже.'
0,Отзывы,'Загорелся чек эндж машина на гарантии',23.08.2016, 19:12,Hast,'Проездил неделю нормально Потом симптомы повторились. То есть горит чек желтым машина немного дергается и на холодном двигателе заметно троит сек. 30. Расход вырос до 10л на 100, городской цикл. Буду снимать форсунки и чистить вот ищу где. Машина прошла 53000, заправлялась 95 м. на нормальных как мне казалась заправках.'
0,Отзывы,'Загорелся чек эндж машина на гарантии',24.08.2016, 16:36,EvgenySh,'На выходных промывал форсунки на Гетце (вторая машина в семье). Причиной послужила одна заправка хреновым бензином. Начиналось потихоньку, сначала троила на холодную при запуске, через день чек стал моргать, через пару дней чек загорелся, троила уже на горячую. Кое как бак откатали, залили на BP 95-й и через 20 км все закончилось, даже ошибка из ЭБУ стерлась. Когда снял форсунки, на них было приличное количество смолы, которое легко удалилось очистителем карбюратора. Получилось, что сопла форсунок нормальным бензином промылись. Промывка инжектора без снятия спасает не на долго, смола все равно потом может забить сопла форсунок'
0,Отзывы,'Загорелся чек эндж машина на гарантии',24.08.2016, 17:27,Hast,'У меня к сожалению просто в гаражных условиях не снимешь нужен спец инструмент и разбирать надо полдвигателя. Надеюсь это делать придется не часто. Говорят пошла такая присадка которая TSI двигатели засоряет, но это слухи.'
