Code,Folder,Theme,Message
3,Ходовая,'Тормозные колодки Киа Рио 2017-2020',21.01.2019 17:21,Kirill3plkill,' Добрый вечер всем!!! Подскажите какие передние колодки для Вас считаются самыми оптимальными? Оригинальные за 6к рублей ни в счёт) поделитесь опытом работяги, у меня будет первая самостоятельная замена, ОД сказал ничего не менять!) Дали рекомендацию, пробег 30 т. км p.s На гарантию влияет как то? Если вместе оригинала на аналог поменять так сказать, всё таки на ТО-шки пока езжу обслуживаюсь у них... '
3,Ходовая,'Тормозные колодки Киа Рио 2017-2020',21.01.2019 18:28,Димася,' некоторые всё ещё велосипед пытаются изобрести, а уж без слова ГАРАНТИЯ спать не ложаться. Омывашку заливают и гарантийную матру повторяют............ '
3,Ходовая,'Тормозные колодки Киа Рио 2017-2020',21.01.2019 18:52,demis,' У супруги киа рио 12 года. менял ей передние колодки на пробеге 23000. Когда поехал менять передние колодки к дилеру, то вынесли оригинальные колодки за 4200 рублей...НО! у меня были свои колодки MANDO кажется MPH 43 или 47. Кстати, внутри оригинала лежали именно такие мандо как у меня. Тормозят они кстати вполне адекватно, особо не пылят. Цена на них более чем гуманная, около 800 рублей всего! Задние колодки тоже взял Мандо, перед этим заехал к дилеру и посмотрел что лежит в коробке с оригиналом. Взял такие же, но без оригинальной наценки. Кстати, свечи на наши киа рио в коробке с оригинальными надписями стоят на четверть дороже, чем обычные НЖК, которые собственно и лежат внутри. '
3,Ходовая,'Тормозные колодки Киа Рио 2017-2020',21.01.2019 18:59,Димася,' вы сОвсем не видите название раздела "РИО 17-19" У них кординально другой РИО и они особняком держатся '
3,Ходовая,'Тормозные колодки Киа Рио 2017-2020',22.01.2019 13:05,greh211,' 25% ???ну вы както считаете не правильно!!1578 стоят150,а "оригиналы от мобиса" c 061 на конце 600....350% однако '
3,Ходовая,'Тормозные колодки Киа Рио 2017-2020',22.01.2019 13:12,greh211,' Бери саншинги или NIBK и не парься...при замене обязательно заменить смазку в направляшках... '
3,Ходовая,'Тормозные колодки Киа Рио 2017-2020',22.01.2019 22:23,дакота,' сомневаюсь, чтобы диски точили алмазными резцами - не тот металл, чтобы так тратиться. скорее всего твердосплавом обрабатывают. самое главное - заточка инструмента, вот для этого используют алмазное напыление! '
3,Ходовая,'Тормозные колодки Киа Рио 2017-2020',23.01.2019 14:33,greh211,' Чутка не понял??старые диски точнули или взяты диски с перфорацией? '
3,Ходовая,'Тормозные колодки Киа Рио 2017-2020',23.01.2019 15:24,антип,' Нет, имел ввиду что поставил литые колесные диски КиК 685 черный алмаз.) На них пыль от колодок заметна меньше '
3,Ходовая,'Тормозные колодки Киа Рио 2017-2020',23.01.2019 16:00,greh211,' крутяк..диски симпотные+кики очень качественная продукция..сам катаю кик джереми алмаз..влетал в такие ямы ,что думал всё...ан нет.....Смотрятся супер..Ну а по именно тормозным комплектам.. Я очень долго катал диски сток+колодки фрикса..супер(по сравнению со стоком мандо)..но пришло время когда фриксы перестали удовлетворять...взял саншиги и это скажу реальная пушка.. Сейчас перед-диски саншинг+колодки саншинг Зад диски брембр+колодки саншинг... Ни пыли,ни писка....отзыв тормозов как на нулёвой(только из салона)...дунул на педальку и уже остановка.. '
3,Ходовая,'Тормозные колодки Киа Рио 2017-2020',24.01.2019 16:09,аdmin,' Это Вы какой-то дорогой магазин нашли. Оригинальные колодки на Киа Рио можно найти примерно за 4600. Практически никак не влияет, можете смело использовать неоригинал. Вы сами смотрели сколько еще осталось на колодках? После рекомендаций по замене колодок, которые дают некоторые сервисы, часто можно проехать на колодках еще 10-20 тысяч км. '
3,Ходовая,'Тормозные колодки Киа Рио 2017-2020',24.01.2019 19:23,тагир05,' поменял передние стоковые колодки на 52000км. '
3,Ходовая,'Тормозные колодки Киа Рио 2017-2020',27.01.2019 20:53,Сандро sochi,' Здрасти всем ! Посоветуйте какие колодки поставить на перед ,на предыдущем авто стояли АТЕ ! Но цена на них кусается TRW ,или BREMBO ? Оригина чёт мне не нравиться ,шумные и за 3500 зделали! канаву на диске ! Киа Рио 18 год '
3,Ходовая,'Тормозные колодки Киа Рио 2017-2020',27.01.2019 21:52,Димася,' 5 стр этой темы и посвящены этому '
3,Ходовая,'Тормозные колодки Киа Рио 2017-2020',27.01.2019 22:18,Roman1975,' Вас не поймешь. Сказал ОД не менять, так чего менять? Я, на днях прошел ТО-3 ,43550 км пробега было. Остаток передних колодок 7 мм, задних 7,5 мм (минимально допустимый 2 мм) Че Вы там менять собрались и зачем? Нормально ходят заводские колодки, даже сказал бы очень даже долгоиграющие, раз за 44 т.км. осталось еще 7 мм. Но диск по моему кушают. Хотя тут сложно судить. Че Вы туда на 30 т.км лезть собрались не понимаю. Хотя мож у Вас горная местность и Вы уже ушатали колодки за 30-ку. '
3,Ходовая,'Тормозные колодки Киа Рио 2017-2020',27.01.2019 22:46,greh211,' не кушают а жрут!!!!((((у меня стоковые сожрали за 24 тыс столько же ,что и 3 комплекта фрикс...сток в топку .....если не хочешь каждые 2 комплекта колодок менять диски...хотя Вам оно и не нужно заморачиваться...всё равно продаёте после 60-70 тыс...хотя не очень уверен,что через 2 года у простых смертных будут деньги на Роскошь в виде автомобиля!!(( лично я выкинул родные на 24 тыс...так как сердце кровью обливалось при виде,как грызут диски,да ещё и пищат и пылят..на литье скорость износа диска очень бросалась в глаза... Думаю и рио4 тто же самое... '
3,Ходовая,'Тормозные колодки Киа Рио 2017-2020',27.01.2019 22:48,greh211,' Бери проверенные годами саншинги..не пылят,ни пищат,диски не жрут...тормоза отменные....стоят в 3 раза дешевле стока...SP 1399 '
3,Ходовая,'Тормозные колодки Киа Рио 2017-2020',28.01.2019 00:00,Roman1975,' Я не хочу менять ни то ни другое, Хочу что бы они в паре отработали до 70-100. А, "скользкие" колодки не жрущие диск я пробовал на других авто, не понравилось. Пока не вижу смысла менять заводские. Игру "шило- на мыло" проходил уже не один раз. '
3,Ходовая,'Тормозные колодки Киа Рио 2017-2020',28.01.2019 08:20,pen,' какое необычное видение если не "жрут" диск - значит НЕ тормозят? Смысл колодок и состоит в том, чтобы изнашиваться накладкам..а не выгрызать металл ну не меняйте..кто ж заставит) просто уже многолетние опыты тысяч пользователей говорят об очевидном. '
3,Ходовая,'Тормозные колодки Киа Рио 2017-2020',28.01.2019 08:53,greh211,' даже не понима ю о чём речь..тормоза работаю только дунешь на педаль...или вы думаете,что я полный дебил???без тормозов 200 км в час езжу???... У вас глубокое заблуждение по этому поводу... ну не знаю на чём вы игрались??!!!я же говорю о том,на чём езжу 5 лет... '
3,Ходовая,'Тормозные колодки Киа Рио 2017-2020',28.01.2019 09:58,Roman1975,' Смысл колодок состоит в том, что бы останавливать вращение тормозного диска. Возможно и так. Но, выкинуть рабочие заводские колодки рука не поднимается. '
3,Ходовая,'Тормозные колодки Киа Рио 2017-2020',28.01.2019 10:08,greh211,' ну тут как говорится в народе:хозяин-барин..я и заводскую кумхо на 4 тыс пробега отдал на шиномонтаже за работу...(лично длч меня такое говно даже стыдно продавать,не говоря о том ,что бы её использовать)... '
3,Ходовая,'Тормозные колодки Киа Рио 2017-2020',28.01.2019 10:19,Roman1975,' А, я все ж таки докатал заводское Кумхо. Согласен, резина говняненькая. Тока меня начинают посещать мысли поменять авто, а не колодки. '
3,Ходовая,'Тормозные колодки Киа Рио 2017-2020',30.01.2019 06:47,Сандро sochi,' Господа ! Сейчас менять шило на мыло ,нет смысла ! Что колодки ,что автомобиль! Говно ! ! ! Как смартфон самсунг ! Попользовался и на свалку , нет безопасности ! Смотрел последние городские новости ,дтп сплошное мясо в перемешку с железом ! Раньше как то реанимация помогала ! А сейчас нет ! Какие колодки ? Какая кумхо ! ? Сам метал как туалетная бумага ! '
3,Ходовая,'Тормозные колодки Киа Рио 2017-2020',30.01.2019 12:55,Димася,' спой : Что наша жизнь..................? ты зачем сюда явился то? '
3,Ходовая,'Тормозные колодки Киа Рио 2017-2020',30.01.2019 16:10,greh211,' это наружний метал такой...это и есть пассивнвная безопасность ....это сделано для нанесения наименьшего вреда пешеходу... главное в современном авто это капсула,которая сделана из высокопрочных металлов с услителями деформаций... Так же к пасивной безопасности относится сендвичная компоновка подкапотного пространста..при аварии это всё должно оторватся и деформироваться с наименьшим перемещением в салон... зачем купили ???нужно было УАЗ 3151,ЛАДА 4×4 брать...там ещё остались задатки 60х годов... '
3,Ходовая,'Тормозные колодки Киа Рио 2017-2020',30.01.2019 18:38,Димася,' ну если только в "качестве" сборки и ржавлении ещё до продажи '
3,Ходовая,'Тормозные колодки Киа Рио 2017-2020',30.01.2019 20:11,greh211,' И устрашающей надёжности при аварии... '
3,Ходовая,'Тормозные колодки Киа Рио 2017-2020',31.01.2019 10:47,kat096,' Кто будет брать "проверенные годами саншинги", которые SANGSIN HP, смазку не покупайте, она уже вложена в каждую коробочку. Я ещё на КУМХО...весной поменяю наконец. Смартфон самсунг валяется дома, поменяла на хуавей, не нарадуюсь - падал в воду (в туалет) и работает прекрасно, камера супер. Айфон не нужен нафиг. И меня искренне удивляют люди на мерседесах, живущие в пятиэтажках, а также те, кто этот айфон покупает, а ботинки с острыми носами за тысячу рублей. '
3,Ходовая,'Тормозные колодки Киа Рио 2017-2020',31.01.2019 11:27,greh211,' и ездящие летон на шипованной резине!!! '
3,Ходовая,'Тормозные колодки Киа Рио 2017-2020',22.02.2019 13:46,Avercin,' Ездил на то 1 пробег машины 14000 ...сняли колёса откинули суппорта замерили штангеном тормозной диск итог такой...диск 21 мм -1 мм за год ...колодки 8 мм -2 мм за год...машина на автомате город основной..езжу по разному Выше 3000 оборотов пару раз в месяц кручу...с таким успехом на 30 тыс замена тормозного диска...спросил у од что за хрень говорят металл такой г...посмотрел на них удручающе и понял что им вообще пофиг лишь бы бабки за то дали...заказал на автодоке SANGSIN придут буду ставить...Вопрос а как же газели и маршрутки ездят по городу тормозят и разгоняются будь здоров и пробеги по 100000 за год и нормальные у них диски в итоге... '
3,Ходовая,'Тормозные колодки Киа Рио 2017-2020',22.02.2019 22:08,дакота,' а материал всегда разного качества - для разных авто, разного бренда, даже разных партий з/ч. гдет чутка, а где-то откровенное гавно продают. вы не знали? '
3,Ходовая,'Тормозные колодки Киа Рио 2017-2020',23.02.2019 10:38,Avercin,' Да я так и понял что в новых уже заложено старение машины...зачем делать на года долгие ... '
3,Ходовая,'Тормозные колодки Киа Рио 2017-2020',23.02.2019 10:48,Димася,' естественное старение ВСЕГО заложено мирозданием и природой. тут скорее речь идёт о не стабильности качества комплектующих в зависимости от партии или поставщика оных, а так же от ареала использования авто( н.п. в крупных мегаполисах реагенты делают своё дело) эта тенденция у мирового автомобилестроения уж как лет 15 Но если бы она была чрезмерной у некой марки авто, то эту марку просто перестали покупать '
3,Ходовая,'Тормозные колодки Киа Рио 2017-2020',25.02.2019 09:34,Xan,' В таком случае лучше поставить Brembo/ATE/Textar, чем непонятный Mobis, который по уровню качества еле дотягивает до регламентных ТО... '
3,Ходовая,'Тормозные колодки Киа Рио 2017-2020',25.02.2019 11:59,greh211,' прежде чем это писать,вытащите колодку и посмотрите производителя..там стоят мандо..так же стойки,пружины,аммортизаторы,рулевая колонка. вы лично это ставили на рио??или это ваше предположение??? '
3,Ходовая,'Тормозные колодки Киа Рио 2017-2020',05.03.2019 10:46,Xan,' Поясню - MANDO там стоит именно потому, что это корейский концерн, который и создавался в 1962 году для обеспечения корейского же автопрома. И который изначально и на данный момент специализировался на амортах! ЧТо и так понятно - своей автомобильной шоколы там не было, как в Германии, поэтому качество правилось при серийном выпуске из года в год. По амортам - вполне достойно, но не BOGE или Bilstein. И даже не группа ZF с их SACHS. А мобис я написал, т.к. при заказе через ОЕ катклог либо дилера будет именно номер ОЕ (под этими же брендами KIA/HYUNDAI/MOBIS). Что касается опыта эксплуатции перечисленных брендов курпнейших производителей тормозных систем - то да, ставил и буду ставить. Расскажу по секрету, как человек, который всю жизнь работает в сфере именно з/ч - Brembo важно. какие будут отзывы по их товару у потребителей и будут ли их колодки/диски выбирать конечные клиенты, отсюда и прогнозируемое качество. MANDO, которое пакует завод под общим MOBISом либо просто ОЕ - контаркт подписан, его и так купят. '
3,Ходовая,'Тормозные колодки Киа Рио 2017-2020',05.03.2019 14:07,greh211,' уж чего чего а пояснять не нужно..и так всё ясно..вы сами в своём посту написали ,что лучше поставить брембо/ате/текстар чем НЕПОНЯТНЫЙ Мобис!!я же пишу что в коробке Мобис лежат Мандо,которые стоят с завода.. ну если не лень прочитайте форум по колодкам с 2011 года..тут было сотни эксперементов и миллионы км пробегов!!ставили и брембо и ате...но не прижились....а вот саншинги и фриксы только в путь... '
3,Ходовая,'Тормозные колодки Киа Рио 2017-2020',05.03.2019 14:30,Xan,' Это говорит лишь о том, что тендер на конвеерную поставку выиграла данная компания. Логично, что здесь присутсвтует большая доля отечеств. лобби корейцев А про то, что ставили и что не прижилось - вопрос цены))) Сколько людей будут драть волосы за Kama или Cordiant, говорить, что и 200 ездят и на 10 лет хватает. А по факту раз со 100 км/ч в пол оттормозиться и можно сразу же и колеса разбортировать на такой резине. Итого - на вкус и цвет... '
3,Ходовая,'Тормозные колодки Киа Рио 2017-2020',05.03.2019 14:47,greh211,' каким боком здесь пример резины...тут вроде колодки ..и именно для рио какое лобби???!!!это корейский авто...в нём и корейские комплектующие....как и во всём мире...америкосы делают от америкосов,немцы от немцев...это только автоваз сделан из всего чужого,лиж бы не из своего!!!.... '
3,Ходовая,'Тормозные колодки Киа Рио 2017-2020',05.03.2019 17:56,Димася,' Корейцам кои уже догнали вашу присловутую Сообщение от Xan ↑ автомобильной школы как в Германии , тем паче большинство "германЬского" в китае делается. Т.Ч очередные сказки венского леса от спецамноголетнегоопыта и скорее со своей не навязчивой рекламой........... '
3,Ходовая,'Тормозные колодки Киа Рио 2017-2020',05.03.2019 18:33,greh211,' а для мерседесов с пакетом АMG двигатели вручную теперь собирают мигранты !!настоящее немецкое качество однако!!в этом ролике будет названо имя сборщика...досмотреть до конца '
