Code,Folder,Theme,Message
3,Ходовая,'Дребезг (подобно банке с болтами) спереди справа на неровностях',07.11.2018 18:11,King,' Приветствую ! Создал новую тему, так как проблема очень напрягает и в моём городке не у меня одного, но что это такое понять никто не может. Очень напрягает отчётливо слышный посторонний звук спереди справа при проезде неровностей (залатанный асфальт, при съезде с лежачего полицейского...), звук похож больше на дребезг что-ли, но не стук, будто металлическую банку с болтами где-то запрятали ! И точно не пойму откуда звук-то ли от подвески или от каких-либо наружных элементов, то ли из под капота...будто что то подкидывает на неровностях и возвращает обратно (банку с болтами) ! Начало прослушиваться отчётливо это с первой тысячи км ! '
3,Ходовая,'Дребезг (подобно банке с болтами) спереди справа на неровностях',07.11.2018 18:14,ссе,' Как версия: ежели стоит защита, то поищите под ней камешек какой, или, скорее всего гаечку-болтик. К стати, из моей неравной борьбы со стуками-грюками: откройте капот и потрогайте "кочергу"(упор капота). Если болтается с этим самым звуком, то намотайте изоленту на него или поправьте накладку(типа трубочки, ну не знаю как правильно называется!) на нём в районе крепления упора к капоту. Успеха и отпишитесь '
3,Ходовая,'Дребезг (подобно банке с болтами) спереди справа на неровностях',07.11.2018 18:22,King,' В том то и проблема, что все эти элементарные вещи уже проверены и ничего не является причиной... '
3,Ходовая,'Дребезг (подобно банке с болтами) спереди справа на неровностях',07.11.2018 18:22,Мав,' @King, думаю вариант не Ваш, но все же скажу. Когда-то, когда начал ездить на Киа Рио столкнулся с подобной проблемой, два дня не мог понять откуда побрякивание. Оказалось, очки в очечнике гремели. Но звук шел откуда угодно, но не из очечника). '
3,Ходовая,'Дребезг (подобно банке с болтами) спереди справа на неровностях',07.11.2018 18:26,ссе,' Ну тогда ищите. Но не так, как в том фильме: "Пилите Шура, пилите". Успеха и отпишитесь, что же там гремело. '
3,Ходовая,'Дребезг (подобно банке с болтами) спереди справа на неровностях',07.11.2018 18:30,King,' Благодарю за предположения...но звук явно не в салоне. Уже вообще не знаю что и думать..., так как реально напрягает. Летом был на 0 ТО, с механиком поехал кататься а этот звук так и не проявился (кстати в жару он немного исчезает, видимо играет роль свойство любого вещества расширяться при действии тепла), говорят всё у тебя в порядке братан, езжай ты домой и всё. '
3,Ходовая,'Дребезг (подобно банке с болтами) спереди справа на неровностях',09.11.2018 21:43,дмитрио,' как все?а деньги? звук откуда?подвеска тормоза или салона? '
3,Ходовая,'Дребезг (подобно банке с болтами) спереди справа на неровностях',09.11.2018 22:08,дакота,' тоись все проданные новые машины с одного салона и все дребезжат? месть обиженного менеджера? тогда не лишне огласить весь список проверенных вариантов, чтоб мы не повторялись! к примеру т/колодки проверяли? '
3,Ходовая,'Дребезг (подобно банке с болтами) спереди справа на неровностях',09.11.2018 22:30,Roman1975,' Хреновый у Вас городок. Видимо никто рученками в авто залезть не хочет, тока думают с понимающим видом. '
3,Ходовая,'Дребезг (подобно банке с болтами) спереди справа на неровностях',10.11.2018 18:02,King,' тормозные колодки на совершенно новой машине ?)) они новые ) суппорта вроде как не являются источником этого дребезга...проверял путём придерживания педали тормоза на неровностях, всё равно дребезг. звук не из салона точно. А вот точно понять подвеска ли это...либо что-то в подкапотном пространстве может...не могу. Стоит у меня и защита металлическая, поверх неё пластиковая заводская, думал может они...но снимал обе, ездил без них, всё равно то же самое. '
3,Ходовая,'Дребезг (подобно банке с болтами) спереди справа на неровностях',10.11.2018 23:04,дакота,' как-то гремело у меня впереди, долго искал, картер, коробку снимал...оказалось - ступичный на заднем колесе! '
3,Ходовая,'Дребезг (подобно банке с болтами) спереди справа на неровностях',11.11.2018 03:14,greh211,' чего?чего?... '
3,Ходовая,'Дребезг (подобно банке с болтами) спереди справа на неровностях',11.11.2018 08:31,дакота,' не на рио! '
3,Ходовая,'Дребезг (подобно банке с болтами) спереди справа на неровностях',11.11.2018 09:58,greh211,' фу ты... На киа рио задние подшипники иначе ...начинается шум(гул) и обязательно вибрация по всему кузову... '
3,Ходовая,'Дребезг (подобно банке с болтами) спереди справа на неровностях',11.11.2018 12:23,Slazernomad,' Вставлю свои 5 копеек. Вчера стал слышать странный звук при проезде лежачих. Словно правое колесо Вот-вот отвалится. Ездил минут 15 по лежакам. Потом заглянул наконец и понял, что кто-то криворукий поставил звукоизолирующий подкрылок неровно немного отверстием относительно пружины. В итоге пружина цепляла его и стоял этот грохот. Отогнул его немного руками и тишина наступила. При поездке на то попрошу нормально его переустановить. '
3,Ходовая,'Дребезг (подобно банке с болтами) спереди справа на неровностях',11.11.2018 12:36,greh211,' а это чего такое??? '
3,Ходовая,'Дребезг (подобно банке с болтами) спереди справа на неровностях',11.11.2018 13:30,антип,' Подкрылок для звука.) '
3,Ходовая,'Дребезг (подобно банке с болтами) спереди справа на неровностях',11.11.2018 13:59,дакота,' не "для" а "от"! '
3,Ходовая,'Дребезг (подобно банке с болтами) спереди справа на неровностях',11.11.2018 22:13,greh211,' даже так????а я думал,что ету требуху лепят ",бывшие" тазоводы по привычке,чтоб не сгнили арки!!!а оказывается это шумоизоляция???!!!...абалдеть!!! '
3,Ходовая,'Дребезг (подобно банке с болтами) спереди справа на неровностях',12.11.2018 13:39,Slazernomad,' Для не очень думающих: С внутренней стороны изоляционный материал, с которым щебенка слетающая с колес не слышна. Разница с обычный подрылком и со звукоизоляцией ОЧЕНЬ даже ощутима. '
3,Ходовая,'Дребезг (подобно банке с болтами) спереди справа на неровностях',13.11.2018 19:05,greh211,' лично пробывали на киа рио оба вида?мерили шумомером??? на киа рио слышна щебёнка,которая именно бьёт по коробу.. '
3,Ходовая,'Дребезг (подобно банке с болтами) спереди справа на неровностях',14.11.2018 01:05,Slazernomad,' лично пробовал. Мерил шумомером. '
3,Ходовая,'Дребезг (подобно банке с болтами) спереди справа на неровностях',15.11.2018 12:18,Sepa_1988ser,' Всем здравствуйте! Попробуйте снять панель над спидометром там спрян блок управления сигналкой ( официалам проще его туда воткнуть ) у меня он лежал на какой-то железной раме и создавал бряканье на кочках мелких! Закрепил чтоб не шевелился и бряканье исчезло! Сам думал что где-то в правом колесе а оказалось там вот так! '
3,Ходовая,'Дребезг (подобно банке с болтами) спереди справа на неровностях',13.07.2019 22:24,paly42006,' Подтверждаю тоже как банка с болтами справа дребезг при проезде неровностей, не всех, чаще возникает при проезде резких, острых,стыков , например на мосту т.п. кто-нибудь нашел причину? '
3,Ходовая,'Дребезг (подобно банке с болтами) спереди справа на неровностях',24.07.2019 18:19,ШИЛА,' Попробуйте постучать по бачку для омывайки - он с чем то соприкасается и издает такой звук '
3,Ходовая,'Дребезг (подобно банке с болтами) спереди справа на неровностях',08.08.2019 19:25,krokotaun,' У меня такая же проблема сзади,все перебрал,2 сервиса обьехал,в обеих сделали вывод-направляющие суппортов менять,грохочет как банка с болтами,буду менять.хотя руками дергаешь,ничего не болтается!!пробег 86000 все родное стоит еще.киа рио 3.2013 год. '
3,Ходовая,'Дребезг (подобно банке с болтами) спереди справа на неровностях',08.08.2019 19:36,дмитрио,' вытащи сам и посмотри резиновые колечки.надо их смазывать правильной смазкой... '
3,Ходовая,'Дребезг (подобно банке с болтами) спереди справа на неровностях',09.08.2019 22:15,ссе,' Откройте капот, и "потарахтите" упором капота, не открывая его. Этот звук? '
3,Ходовая,'Дребезг (подобно банке с болтами) спереди справа на неровностях',09.11.2019 14:40,Andrey Victorovich,' Аналогично, недавно заметил некоторое несильное громыхание спереди, будто из под капота. Слышно только при медленной езде по неровностям. Не пойму откуда берется, думал капот громыхает - резиновые демпферы подрегулировал. Снизу смотрел, защиту картера проверил, болтающиеся пластиковые дюбели укрепил на пластиковой защите. Впечатление, что под капотом что-то плохо закреплено и погромыхивает. Были теплые дни (до 20 гр.С) - шума не было. Сегодня +10 - опять слышно громыхание при медленной езде (до 5..10 км/ч) по кочкам. Пробег 15 тыс. км (14 месяцев). '
3,Ходовая,'Дребезг (подобно банке с болтами) спереди справа на неровностях',03.04.2020 07:51,Myxa-82,' да че то гремит только с левой стороны, пока немогу найти '
3,Ходовая,'Дребезг (подобно банке с болтами) спереди справа на неровностях',26.09.2020 20:58,ivb,' Тоже появилось бряканье при езде по неровностям. Сначала на больших скоростях (90-110), теперь около 80 км/ч слышно. Грешу на ремни безопасности. Подскажите кто-нибудь снимал пластиковую обшивку стоек, чтобы добраться до механизма ремней? Как она держится? '
3,Ходовая,'Дребезг (подобно банке с болтами) спереди справа на неровностях',27.09.2020 11:47,вован-74,' снимал . толку не будет гремит в нем сама катуха на что ремень наматывается.ее ни чем прижать не удастся .единственое болт крепления ее к кузову через пластиковую шайбу там можно что то добавить чтоб не хлябала '
3,Ходовая,'Дребезг (подобно банке с болтами) спереди справа на неровностях',27.09.2020 22:29,ivb,' Ну так раньше то не гремела? Значит что-то открутилось? Или какая-то пластиковая шайба уменьшилась в толщине. Ну или ещё что нибудь... '
3,Ходовая,'Дребезг (подобно банке с болтами) спереди справа на неровностях',24.11.2020 09:30,Almaz 969,' @King, Приветствую, удалось найти источник шума? Проблема в точности как у тебя, машина новая, ни дилер, ни другие СТО не могут найти причину. '
3,Ходовая,'Дребезг (подобно банке с болтами) спереди справа на неровностях',24.11.2020 10:27,ссе,' Проверьте упор капота '
3,Ходовая,'Дребезг (подобно банке с болтами) спереди справа на неровностях',24.11.2020 10:45,Almaz 969,' Проверял, резинку крутил и туда и сюда, бачок омывателя проверял не болтается, пыльник и защиту картера снимал думал может они брынчат, номер с бампера тоже снимал, но как оказалось дело не в них((( '
3,Ходовая,'Дребезг (подобно банке с болтами) спереди справа на неровностях',24.11.2020 12:31,alco-naft,' Где-то вроде тут было видео, когда в подрамнике через эндоскоп обнаружили мелкие камушки, которые и бренчали на кочках и выносили мозг владельцу. '
3,Ходовая,'Дребезг (подобно банке с болтами) спереди справа на неровностях',24.11.2020 16:05,Almaz 969,' Спасибо, поищу Нашел видео, у меня звук не проявляется при трогании и т.д., а при попадании переднего правого колеса на небольшую ямку или трещину на асфальте, или когда колесо съезжает с асфальта на срезанный участок асфальта. '
3,Ходовая,'Дребезг (подобно банке с болтами) спереди справа на неровностях',26.11.2020 19:24,King,' Не удалось найти источник этого раздражающего звука до сих пор, уже просто привык и не обращаю внимание. Но ездил на киа рио таких же, у всех этот звук ! Это наверно фирменная "фишка" ))) просто я так понял не разбирается в устройстве авто и в том какие звуки норма а какие нет - то у тех всё в порядке, или кто ездит только по ровному асфальту. '
3,Ходовая,'Дребезг (подобно банке с болтами) спереди справа на неровностях',27.11.2020 23:03,Almaz 969,' А у тебя колпаки на колесах или литье? сегодня отбивал снег с колес и заметил, что заводские колпаки хоть и крепятся гайками, но достаточно сильно стучат об диски, вот задумался может быть дело в них. до этого у меня был киа рио 3 и киа рио 3 рестайлинг, солярис и в них такого шума не было( '
3,Ходовая,'Дребезг (подобно банке с болтами) спереди справа на неровностях',28.11.2020 09:55,King,' Нет, на лето литьё, на зиму штампы без колпаков, колпаки не люблю. Так что однозначно не в колпаках дело. Мне всё же кажется это что то в подкапотном пространстве. Или ещё как то я заметил, что вал со ШРУСАМИ справа имеет очень приличный люфт, даже за колесо болтаешь и оно как будто подстукивает, может оно ??? обрати внимание, или когда сильно ногой по правому колесу бьешь, то тоже какой то стук '
3,Ходовая,'Дребезг (подобно банке с болтами) спереди справа на неровностях',30.11.2020 18:34,АндрейД,' Тоже появилось бряканье металлическое, слышно на малой скорости с открытым окном. Заметил неделю назад. Все продергал, протряс, ничего не нашел. Вывесил колесо, вращаешь на нейтрали и периодически металлический звук раздается. Без колеса за ступицу вращаешь - тоже. Люфтов, заеданий не чувствуется. Записался на сервис на 3 число. Да тормозной диск трогал по приезду - не горячий. Пробег 30 тыс км. '
3,Ходовая,'Дребезг (подобно банке с болтами) спереди справа на неровностях',01.12.2020 19:13,Евгений RUS-32,' Тоже присутствует такой звук, когда съезжаешь с лежащего полицейского. Но не постоянно- зависит, то ли от температуры воздуха или влажности, пока не понял. '
3,Ходовая,'Дребезг (подобно банке с болтами) спереди справа на неровностях',03.12.2020 19:01,АндрейД,' В сервисе из тормозного диска извлекли камушек с нокоть (снимали тормозной диск). '
3,Ходовая,'Дребезг (подобно банке с болтами) спереди справа на неровностях',11.12.2020 20:35,AndrewOST,' У меня брякала в тормозе диска стекляшка)))) '
3,Ходовая,'Дребезг (подобно банке с болтами) спереди справа на неровностях',12.12.2020 19:20,Nissas,' X-Line 2020, авто жены, аналогичная фигня. Появился стук, но сейчас пропал. Версия с камушками - не вариант, у всех одинаковая проблема, проблема сборки. '
3,Ходовая,'Дребезг (подобно банке с болтами) спереди справа на неровностях',12.12.2020 19:51,дакота,' амортизатор проверяли? какое колесо? переднее? на поворотах слышно? вперед-назад? бряканье на оборот колеса или само по себе? валы, шрусы, подшипник? '
3,Ходовая,'Дребезг (подобно банке с болтами) спереди справа на неровностях',13.12.2020 13:15,Евгений RUS-32,' Как я его проверю? '
3,Ходовая,'Дребезг (подобно банке с болтами) спереди справа на неровностях',13.12.2020 14:56,дмитрио,' его надо постучать по голове Дакоты,или по пустой кастрюле,чтоб был звон. '
3,Ходовая,'Дребезг (подобно банке с болтами) спереди справа на неровностях',14.12.2020 06:51,дакота,' ежели нельзя проверить, так сказать, мануально - раскачкой, пусть кто-то посмотрит со стороны когда будете ехать по неровной дороге - колесо не "облизывает" неровности, а скачет по ним. обычно слышен стук при съезде колеса в ямку на скорости, когда проблемный амортизатор. ну и визуально - потеки, сайлентблоки. да похоже на то, что звон был именно в твоей кастрюле, пока ты в школе срок отсиживал на уроках по русскому. вон как до сих пор резонирует! попробуй виброй обмотать, щютник, авось поможет! '
3,Ходовая,'Дребезг (подобно банке с болтами) спереди справа на неровностях',14.12.2020 22:13,Евгений RUS-32,' Амортизаторы не так стучат и визуально целые, без потеков. '
