Code,Folder,Theme,Message
3,Ходовая,'"трущийся" звук при повороте рулевого колеса',28.02.2020 22:30,Митричъ Фабулин,' Появился звук, как в описании, и ссылка на видео чуть выше, пост №12 Срок владения 1,3 года, пробег 15500 км Приехал к дилеру Барс, г. Омск, записался на определенное время. В оговоренное время прибыл, все потраченное время на посмотреть/послушать, заняло не больше 15-20 минут. Сразу сказали, приговариваем рулевую колонку, и надо подождать пару недель. Позвонили примерно через неделю, пригласили на замену. Время замены примерно около 2,5 часов. Итог, я доволен. Быстро сработали, коллектив доброжелателен, все предупреждают и оговаривают. Развеяли все сомнения, надо ли оставаться на гарантии, теперь уверен что останусь. Да и в перерасчете количество ден. знаков на год, не так уж и дорого оф. прохождение плановых ТО. '
3,Ходовая,'"трущийся" звук при повороте рулевого колеса',29.02.2020 09:34,greh211,' это про что Вы?про какое оставание идёт речь?как это в первые пять лет можно уйти с гарантии,которую Вам даёт завод изготовитель? '
3,Ходовая,'"трущийся" звук при повороте рулевого колеса',29.02.2020 10:37,2272,' А я открыл капот, побрызгал силиконом на чашки стоек, закрыл капот и забыл. Заняло 3 минуты. '
3,Ходовая,'"трущийся" звук при повороте рулевого колеса',29.02.2020 13:50,alco-naft,' Черт его знает, я чашки стоек в 3-их киа рио не видел, но в четверке туда лить силикон, имхо, бессмыслено - там сверху резиновый пыльник, он неподвижный, никакого толку не будет если на него лить силикон. '
3,Ходовая,'"трущийся" звук при повороте рулевого колеса',29.02.2020 14:22,2272,' Будет, если это он скрипит. Подвижный, когда руль выворачиваешь скрипит о кузов. '
3,Ходовая,'"трущийся" звук при повороте рулевого колеса',29.02.2020 15:54,alco-naft,' Надо будет проверить, а то я там наблюдал под этой резинкой грязь скопившуюся, если бы эта резинка крутилась - эта грязь наверняка или размазалась, или бы ее там вовсе не было. '
3,Ходовая,'"трущийся" звук при повороте рулевого колеса',05.03.2020 09:31,Митричъ Фабулин,' Если посмотреть видео и включить звук, из сообщения выше, что я указал, то понятно становится откуда звук. Соответственно, как можно советовать лить силикон, ответом на пост, где русским по белому рассказано, что диагностировано под замену рулевую колонку. Хочу посмотреть, при такой неисправности рулевой колонки, сколько баллонов силикона будет вылито в чашки, и как быстро это поможет устранению скрипа в рулевой колонке ))))))))))))))))) Это я о том что не посещать оф. дилера на ТО-1-2 и далее, а при появлении неисправностей начать требовать замены неисправных деталей. И к примеру на 50-70 тыс., как быстро отправиться в пешее путешествие, обивать телефоны, пороги и доказывать что это поломка не вызвана не своевременной заменой. Это же обычная логика, посещаешь дилера на ТО - получаешь нормальную обратную связь, не посещаешь дилера - получаешь головомойку если что то сломалось. '
3,Ходовая,'"трущийся" звук при повороте рулевого колеса',05.03.2020 09:52,greh211,' а как на практике?вы это проходили? ??заменой чего?масла в двигателе на ТО у ОД?...или салонного фильтра?каким боком ТО у ОД влияет на гарантию, данную заводом, на рулевую рейку? Обязанность доказательсва причинной связи неисправности лежит полностью на продавце(заводе-изготовителе) '
3,Ходовая,'"трущийся" звук при повороте рулевого колеса',05.03.2020 10:11,Митричъ Фабулин,' Когда ты приедешь к дилеру в первый раз на 60 тыс и скажешь , что то у меня двигатель дымит, как быстро тебе нахрен пошлют, если ты ни у одного дилера не был и нигде по базам не бьешься ? Как быстро ты начнешь суетить и доказывать, что менял масло своевременно ? '
3,Ходовая,'"трущийся" звук при повороте рулевого колеса',05.03.2020 10:24,greh211,' ну для начала не будем придумывать поломку и разводить демагогию по связи между "дымящим" двигателем и заменой масла.Если такой казус произойдёт то и у проходившего ТО у ОД так же будет бодание с ОД.....без деффектовки двигателя ОД не будет вам ни чего делать..а за эту процедуру Вы будете платить из своего кармана Здесь же речь вроде бы идёт о Вашей рулевой рейке??!!! '
3,Ходовая,'"трущийся" звук при повороте рулевого колеса',05.03.2020 10:36,2272,' Ну езжай меняй, потом напиши, помогло али нет. '
3,Ходовая,'"трущийся" звук при повороте рулевого колеса',05.03.2020 12:14,alco-naft,' Нет, по закону о защите прав потребителей экспертизу покупатель будет оплачивать только в том случае, если выяснится, что недостатки возникли по причине кривой эксплуатации, то есть по вине покупателя. Изначально экспертиза делается за счет продавца. '
3,Ходовая,'"трущийся" звук при повороте рулевого колеса',05.03.2020 14:51,greh211,' это экспертиза..а вот разбор двигла и пальцем не пошевелят,пока им деньги не заплатят..и начхать им приезжал ты к ним масло менять или нет..урюки хитропопые ещё те..вот недавно парень писал про выбивание 2 передачи на годовалой рио..один ОД выпучив глаза утверждает,что это не гараниия..второй без денег отказывается разбирать коробку((( '
3,Ходовая,'"трущийся" звук при повороте рулевого колеса',05.03.2020 18:35,alco-naft,' Да они просто охреневшие, что тут еще сказать. С такими только через претензию и отказ в письменном виде, по другому они не понимают. '
3,Ходовая,'"трущийся" звук при повороте рулевого колеса',05.03.2020 20:18,greh211,' в большинстве случаев так всё и происходит(( '
3,Ходовая,'"трущийся" звук при повороте рулевого колеса',08.03.2020 18:44,alco-naft,' Посмотрел сегодня у себя на этот пыльник - он не крутиться вместе с поворотами руля, так что в четвертых ряхах этот узел в чашке, получается, немного другой, и пшикать на него силиконом нет никакого смысла. Либо придется эту резинку снимать и пшикать куда-то под нее. '
3,Ходовая,'"трущийся" звук при повороте рулевого колеса',08.03.2020 18:54,2272,' Так и у меня не крутится, он слегка ёрзает, отсюда скрып. '
3,Ходовая,'"трущийся" звук при повороте рулевого колеса',08.03.2020 18:59,alco-naft,' Черт его знает, я не заметил - выкрутил руль до упора, но резинка не дергалась. Может он начинает ерзать когда машина будет на ходу и стойки будут отрабатывать неровности? '
3,Ходовая,'"трущийся" звук при повороте рулевого колеса',08.03.2020 19:07,2272,' Конечно будет, там ведь с обеих сторон в стакан упираются резиновые демпферы, оно для этого и сделано, чтобы слегка двигалось, ну типа как сайлентблок. '
3,Ходовая,'"трущийся" звук при повороте рулевого колеса',09.03.2020 18:25,Митричъ Фабулин,' А что мешает прочитать и подумать о чем прочитано. Отсюда следует, что замена произведена. Как еще написать и указать для понимания ? '
3,Ходовая,'"трущийся" звук при повороте рулевого колеса',09.03.2020 18:44,2272,' Я вообще то не с тобой разговаривал и мне твоя история была неизвестна, зачем мне её было читать? '
3,Ходовая,'"трущийся" звук при повороте рулевого колеса',09.03.2020 19:01,alco-naft,' Имхо, это больше на пыльник похоже, ну типа что бы просто закрыть отверстие от пыли/влаги. То есть этот кусок резины, в отличие от сайлент-блоков, не несет никакой нагрузки. Надо будет его как-нибудь снять и посмотреть - нет-ли под ним влаги, может просочилась как-нибудь. '
3,Ходовая,'"трущийся" звук при повороте рулевого колеса',09.03.2020 19:21,2272,' Смешно! '
3,Ходовая,'"трущийся" звук при повороте рулевого колеса',09.03.2020 19:47,alco-naft,' Все, разобрался: эта хреновина 54627-H8000 из двух частей состоит, резиновый колпачок, который закрывает гайку - он отделяется и у него свой партнамбер есть. Я-то думал что эта единая конструкция резиновая, типа ее целиком надо снять что бы до гайки добраться. '
3,Ходовая,'"трущийся" звук при повороте рулевого колеса',10.03.2020 17:46,Silence,' тоже есть такой звук, на соляре слева в районе правого стакана. там опорники есть вообще? оттуда звук. '
3,Ходовая,'"трущийся" звук при повороте рулевого колеса',10.03.2020 21:49,Roman1975,' Ну канешна есть, у всех мак-ферсонов есть, иначе как без них проворачивать стойку. Просто есть две разновидности исполнения проворачивания стойки на опорном. В первом варианте стойка проворачивается вместе со штоком, во втором шток стойки неподвижен, а вокруг него проворачивается все оставшиеся в стойке. У нас второй вариант исполнения конструкции Маладец. Это вторая часть специфического сайлент-блока (опоры) крепления стойки к кузову, основная задача сией плюмбы сверху -отрабатывать отбой. Под чашкой находится основная часть сего специфического сайлент-блока (правильней все ж таки опоры), держащая вес авто. Специфика нижней части в том, что наружная часть сией резиновой блямбы никак специально не крепится к кузову, от проворачивания спасает тока сила трения о кузов при нормальном состоянии опорного подшипника. Шток стойки жестко скрепляет обе части, жестко крепится к сей опоре и проворачиваться относительно кузова не должен, это вокруг штока должно вращаться на опорном подшипнике все , что ниже данной опоры. Ну и чем легче вращается опорный подшипник тем естественно меньше нарузка на опору по проворачиванию, к коей она не предназначена. Ну и "пшикать силиконового снаружи" ниче не надо на сей узел, тока навредите в итоге. Там смазка требуется тока опорному подшипнику, но для этого сначала надо разобрать стойку и добраться к нему. '
3,Ходовая,'При нажатии на тормоз пищит правое переднее колесо',30.01.2020 10:53,Вячеслав Н,' при нажатия на тормоз пищит правое переднее колесо. проходил 1 то остаток колодок 90% пробег 9.300 км. В чом может быть проблема? '
3,Ходовая,'При нажатии на тормоз пищит правое переднее колесо',30.01.2020 12:22,аdmin,' Например, в закисании тормозных суппортов, буртике на тормозных дисках, грязи на тормозных колодках. '
3,Ходовая,'При нажатии на тормоз пищит правое переднее колесо',30.01.2020 13:44,pen,' даже трудно предположить... ну на первый взгляд - с "русской язЫкой")) '
3,Ходовая,'При нажатии на тормоз пищит правое переднее колесо',30.01.2020 15:10,ссе,' Попробуйте на пустой сухой дороге на скорости не выше 20 км/час несколько раз резко оттормозиться до срабатывания АБС. Может помочь. Машина то новая, большим буртикам на тормозном диске ещё рано образоваться. А вот грязь, лёд, камушки вполне могут делать мозги. Успеха и отпишитесь '
3,Ходовая,'При нажатии на тормоз пищит правое переднее колесо',30.01.2020 15:11,Мав,' Боюсь, в Нижневартовске это проблема). '
3,Ходовая,'При нажатии на тормоз пищит правое переднее колесо',30.01.2020 17:05,дмитрио,' надо ехать в краснодар. '
3,Ходовая,'При нажатии на тормоз пищит правое переднее колесо',31.01.2020 08:29,Авас,' Было такое,забился прорез на калодках(на самих наклодках),разобрал почистил,писк пропал. '
3,Ходовая,'При нажатии на тормоз пищит правое переднее колесо',31.01.2020 11:04,Димася,' это на каком языке? Молдавском? '
3,Ходовая,'При нажатии на тормоз пищит правое переднее колесо',31.01.2020 17:32,greh211,' молдавонском😀😀😀 '
3,Ходовая,'При нажатии на тормоз пищит правое переднее колесо',31.01.2020 18:47,дакота,' попробуйте плеснуть воды на диск-колодки. если писк исчезнет - виноваты колодки, не исчезнет - снимайте колесо для осмотра - поиск посторонних предметов, работы суппорта, состояния колодок. '
3,Ходовая,'При нажатии на тормоз пищит правое переднее колесо',31.01.2020 18:48,alco-naft,' Только на очень горячий диск лучше не плескать, а то его может повести. '
3,Ходовая,'При нажатии на тормоз пищит правое переднее колесо',31.01.2020 19:01,дакота,' спасибо за своевременное предупреждение - вылетело из головы! '
3,Ходовая,'Левый привод',14.12.2019 11:11,109vlad,' День добрый. У меня КИА РИО 4, коробка механика, двигатель 1.6. Погнул левый вал привода. Новый только в сборе и дорого. Пытался найти на разборах нет. Время поджимает. Но нашёл привод от КИА РИО с движком 1.4 Вопрос: Одинаковые ли они? Если нет в чём разница. Заранее спасибо '
3,Ходовая,'Левый привод',14.12.2019 13:48,аdmin,' Перенес в подходящий раздел форума клуба. '
3,Ходовая,'Левый привод',14.12.2019 14:31,дмитрио,' @109vlad, а как связан привод и двигатель?обычно он связан с коробкой.надо там отличия искать. приложи свой и который нашел.это много времени не займет. '
3,Ходовая,'Левый привод',14.12.2019 14:50,alco-naft,' ШРУСы что на 1.6, что на 1.4 - одни и те-же, значит шлицы на приводах одинаковые. Кузова у 1.6 и 1.4 - одинаковые, коробки одинаковые, подвеска тоже, получается - что и привода должны быть одинаковыми. '
3,Ходовая,'Левый привод',14.12.2019 15:04,дмитрио,' на моторах нет шрусов в зависимости от года выпуска ставились разные коробки '
3,Ходовая,'Левый привод',14.12.2019 19:14,alco-naft,' Понятно, что в моторах ШРУС-ы не находятся, но в зависимости от мощности мотора эти изделия могут быть разными, так вот - что на 1.4, что на 1.6 идут одинаковые. '
3,Ходовая,'Левый привод',14.12.2019 19:36,дмитрио,' они разные в зависимости от коробки.у киа рио мощность мотора не критична,это не гранд чероки SRT. '
3,Ходовая,'Левый привод',14.12.2019 21:08,alco-naft,' Для 1.4 и 1.6 ШРУС-ы идут одинаковые, значит шлицы на приводах одинаковые. '
3,Ходовая,'Левый привод',14.12.2019 21:20,дмитрио,' ты это писал уже(мы прочли. '
3,Ходовая,'Стояночный тормоз - регулировка',10.12.2019 10:22,Proposition,' Добрый день! Как подтянуть трос ручника понятно. Приподнимаю консоль между сиденьями и вот она гайка. Совсем случайно заметил пластиковую заглушку на боковине большого круглого отверстия в консоли, куда вставляется подлокотник. Заглушку снял и получил доступ к задней части самого рычага стояночного тормоза. Так вот там в задней части есть еще гайка, которая, как меня уверяли сервисмены. которые меняли задние тормозные колодки, тоже используется для регулировки натяжения тросса. А на самом деле она для чего? Может кто знает?. '
3,Ходовая,'Стояночный тормоз - регулировка',10.12.2019 20:22,К174,' Не понятно о какой гайке идет речь... у меня она одна там была на штоке. '
3,Ходовая,'Стояночный тормоз - регулировка',10.12.2019 20:51,дмитрио,' и сзади не было барабанов( как это "приподнимаю"? '
3,Ходовая,'Стояночный тормоз - регулировка',11.12.2019 08:30,Proposition,' Вынимаю заглушку из консоли, там в глубине винт на 10 откручиваю его и задняя часть консоли свободно приподнимается, давая доступ к регулировочной гайке. '
3,Ходовая,'Стояночный тормоз - регулировка',11.12.2019 10:20,greh211,' болт '
3,Ходовая,'Стояночный тормоз - регулировка',11.12.2019 10:50,Proposition,' Сфотографировал. На первом фото снята заглушка и видны тросики. На втором снята заглушка сбоку и на третьем видна гайка, о назначении которой я, собственно и спрашивал. '
3,Ходовая,'Стояночный тормоз - регулировка',11.12.2019 10:52,Proposition,' Так вот именно эту гайку крутили сервисмены после замены задних колодок и утверждали, что именно ею регулируется натяжение троса ручника. '
3,Ходовая,'Стояночный тормоз - регулировка',11.12.2019 11:01,alco-naft,' Эта гайка, имхо, просто фиксирует механизм регулировки с тросами к рычагу ручника. '
3,Ходовая,'Стояночный тормоз - регулировка',11.12.2019 17:10,дмитрио,' согласен.это фиксация к ручке ручника.регулировка на первом фото. '
